product,alt1,alt2
Coles Honey Roasted Mixed Nuts,Coles Giant Sour Cola Bottles,Coles Kitchen Caesar Salad Kit
Coles Mini Savoy Cabbage,Coles Royal Gala Apples 1Kg,I&J The Finest Frozen Salmon Portions Skin Off
Coles Italian Passata Sauce,Gs Premium Margherita Pizza,Kettle Sweet Chilli & Sour Cream Potato Chips
Tostitos Mild Cheddar Tortilla Chips,Eurobisc Croissant With Chocolate Cream Filling 6 Pack,Lee Kum Kee Soy Sauce
Bulla Thickened Cream,Sanitarium So Good Long Life Lite Soy Milk 1L,Coles Finest Restaurant Collection Chicken Tsukune Meatballs
Coles Bakery Stone Baked Mini Sub Rolls,Laucke Stoneground Rustic White,Hans Devon
Chobani Strawberry Yoghurt Pouch,Peters Gluten Free Original Neapolitan Multi Flavoured Ice Cream Tub,Bulla Crunch Vanilla Ice Cream 8 pack
Cleaver's Beef Stir Fry Free Range Organic,Coles Lamb Boneless Shank Meat,V2 Sausage Spicy Spanish Plant Based 6 Pack
Kellogg's Coco Pops Chocolatey Breakfast Cereal,Go Ahead Sultana & Forest Fruit Crispy Slice,Sakata Wholegrain Original Rice Crackers
Coles Honey Gold Mangoes Medium,Coles Drumhead Cabbage Mini,Coles Organic Red Onions Prepacked
Coles Coarse Salt Refill Bag,Gravox Our Best Beef Gravy Mix,Youfoodz You Juice Sweet Relief
Simson's Pantry Low Carb Garlic & Herb + Protein,Abbott's Bakery Gluten Free Farmhouse Wholemeal Bread,Coles Congrats Acrylic Plaque Gold & Silver
Coles Red Globe Seeded Grapes,Coles Celery Sticks Prepacked,Coles White Chocolate Candy Speckle Ball
Coles Beef BBQ Burgers 10 pack,Coles Gluten Free Beef Burgers Graze Grass Fed Oregano & Fresh Parsley,Coles Made Easy Slow Cooked Pork Belly Slices In Tonkatsu Sauce
Cocobella Watermelon & Mint Flavour Coconut Water,Jila Sugar Free Spearmint Mints,Fine Fettle Gluten Free Flats Cauliflower & Turmeric
Coles Soft Multigrain Sandwich Loaf,Coles Apple Berry Crumble Tart,Coles Fantasy Cupcakes 4 Pack
Red Rock Deli Sea Salt & Bal Vinegar Potato Chips,Kinder Bueno Chocolate Bar,Barossa Fine Foods French Pate
Kez's Kitchen Choc Crunch Protein Fruit Bars,Shaerge Peanuts Salt,Starbucks Dark Roast Premium Instant Coffee
Queen Victoria  Honey & Vanilla Camomile Tea Bags,Creative Gourmet Frozen Avocado Slices,Birds Eye Frozen Steam Fresh Baby Potatoes With Broccoli Carrots Peas & Herbs 2 pack
Udder Delights Adelaide Hills Ash Brie Cheese,Primo 25% Salt Reduced Leg Ham,Vaalia Kids Strawberry Yoghurt Pouch
Birds Eye Plant Based Burgers,On The Menu Family Cottage Pie,Street Calzone Ham & Cheese 4 Pack
Coles Organic Baby Cos Lettuce,Coles Red Capsicum,Fresh Garlic Cloves Prepacked
Continental Curried Sausages Recipe Base Serves 4,Kapai Puku Gut Health Original Seed,Junior Mints
Coles Dreams Crumb True Chocolate & Caramel Cupcakes 2 Pack,Coles Pavlova,Kong Foo Sing Fortune Cookies
Coles Organic Red Capsicum,Coles Mix-A-Mato Grape Tomatoes,Peters Original Banana Split
Pattu Fenugreek Seeds,Coles Pink Salmon,Lindt Lindor Mini Eggs Value Bag
Cheer Tasty Cheese Block,Pitango Organic Potato With Leek & Parmesan Soup,Yoplait Pouch Apple Chills
Coles RSPCA Approved Chicken Breast Stir Fry,K-Roo Kangaroo Medallions,Muscletech Nitrotech Protein Powder Chocolate
Coles Bakery Multigrain Rolls,Coles Multigrain Dinner Rolls 260g,Balconi Trancetto Cacao Cakes 10 pack
Coles Sleeved Herbs Parsley,Coles Deluxe Natural Mixed Nuts,Coles Creme Gold Washed Potatoes Loose
Coles Artisan Grazing Platter,Smiths Fun Mix Chips 20 Pack,Cadbury Old Gold Roast Almond Dark Chocolate Block
Sunny Queen Free Range Scrambled Egg Mix,Coles Perform Chicken Fried Rice,Jalna Lactose Free Yoghurt Greek Natural
Herb & Sons Chicken-Free Schnitzel,Coles No Added Hormone Beef Scotch Steak With Truffle Butter,Dairy Farmers Thick & Creamy Mango Passionfruit Yoghurt
Coles Fresh Chillies Mixed,Coles Organic Avocados,Lay's Stax Sour Cream & Chives
Provedore Bresaola Italian Style,Cobram Estate Extra Virgin Olive Oil Robust,Heinz Ketchup Tomato Sauce
Tassal Tasmanian Smoked Salmon Twin Pack,Petuna Deli Fresh Salmon Portions Skin On Tray,Coles Beef Stir Fry Strips
Fodmapped Lamb & Vegetable Soup,Sunrice Crunch'Ems Salt & Vinegar,Cookie Time Original Chocolate Chunk Cookie
Devondale Full Cream Long Life Milk,Coles Dairy Tasty Cheese Block,Coles Marinade & Cook Garlic & Herb
Birds Eye Plant Based Burgers,Pacific West Frozen Asian Banquet,Just Vodka Tropical Can 330mL
Whispers Sparkling White 750mL,Shine Orange & Mango Nootropic Drink,Bulla Splits Multi Flavoured Ice Cream Sticks 10 pack
Danone The Ultimate Black Cherry Yoghurt 4x115g,South Cape Apricot & Almond Cream Cheese,Barilla Mulino Bianco Baiocchi
Coles Trimmed Green Beans Prepacked,Coles Sugar Snap Peas Loose,Coles Pitted Medjool Date
Coles High Fibre White Sandwich Bread,Breadtop Custard Bun,Primo Deli Cocktail Frankfurts
Coles High Fibre White Toast Bread,Coles Bakery Stone Baked By Laurent Mini Olive Pane Di Casa,Coles Natures Kitchen Vegan Chocolate Cupcake
Coles Green Smoothie,Shine Brighter Peach Passionfruit Drink,Core Powerfoods Naked Parmigiana
Coles Mozzarella Shredded Cheese,Dolmio Creamy Tomato & Mozzarella Sauce For Pasta Bake,Coles Baby Carrots
Coles RSPCA Chicken Schnitzel Plain Crumb,Coles Lamb Burgers With Rosemary And Garlic 4 Pack,Coles Beef Roast With Mustard And Black Pepper
Don Premium Melosi Ham,Don Virginian Leg Ham Sliced,Helgas Mini Loaf Traditional Wholemeal
Kikkoman Soy Sauce,Coles Sesame Seeds,SPC Spaghetti in Tomato & Cheese
Coles Tasmanian Cold Smoked Salmon,Tassal Tasmanian Smoked Salmon Premium Selection,Talley's Mussels Natural
Small Batch Beef Burger Le Parisien,Coles Deli RSPCA Approved Chicken Breast Kebab Honey Soy,Luv A Duck A L'orange Duck Legs
Coles Parsnips Loose,Coles Pitted Medjool Date,Jalna Lactose Free Sweet And Creamy
Coles Bakery Multigrain Rolls,Coles Flourless Orange Slice 2 Pack,Vege Rice Crackers Tasty Cheese Flavour
Bean Ground & Drunk Organic Decaffeinated Medium Roast Fairtrade Coffee,Gaganis Borlotti Beans,Fantastic Rice Squares Lightly Salted
Vegemite Spread,Fine Foods Sesame Wafer Crackers,Coles Spirals Pasta
Coles Broccoli,Coles Deli Salads Tub Snack Classic Potato,Cruiser Spritz Summer Berry Can 275mL
Coles No Added Hormone Beef Short Rib Fingers,Coles Finest Lamb Hand Cut Frenched Cutlet,Unreal Co Chick'N Chive Sausages
Activia Low Fat Mango Yoghurt 4x125g,Black Swan Avocado Dip,Veef Plant Based Premium Chicken Burger
Coles Made Easy Slow Cooked Pork Belly Slices In Tonkatsu Sauce,Coles Graze Lamb Leg Steak With Thyme And Black Pepper Butter,Wild Oz Venison Steak
Kido Daifuku Matcha Green Tea,Devondale Full Cream Long Life Milk 6 pack,Sanitarium Vegie Delights Vegetarian Food Chorizo Vegie Sausages
Smoked Eggs 6 Pack,Coles Kitchen Potato Gnocchi,Coles Nature's Kitchen Firm Tofu
Arnott's Minis Choc Chip Cookies 7 pack,Beechworth Pure Australian Honey Squeeze,Gravox Roast Meat Gravy Mix Tin
Coles Lamb Kebabs,Coles Pork Loin Chops,Mainland Tasty Cheese Block
Coles Bakery Jam Bunlet,Coles Bakery Banana Bread Slice,Coles Bakery High Fibre Low Gi Soft Round Rolls
Arnotts Jatz & Tasty Cheese,Primo Stacker Danish Salami Cheese & Crackers,Coles Australian Shredded Pizza
Coles Dried Porcini Mushrooms,Coles Butternut Pumpkin Whole,Gourmet Garden Lightly Dried Chilli
Toscano Brioche Burger Bun,Tip Top White Hamburger Rolls,Primo Thin Frankfurt
Denada Sugar Free Ice Cream Banana Sundae,Coles Frozen Fruit Summer Fruit Mix,Coles Original Chicken Tenders
Coles Vegetable Oil Blended,Coles Finest Belgian Block Dark Chocolate 85%,Arnott's Shortbread Cream Biscuits
Coca-Cola No Sugar Vanilla Soft Drink Multipack Bottles 12x300mL,Canadian Club Whisky 700mL,Bulla Splits Summer Splits 10 Pack
Coles Baby Oak Lettuce,Coles Passionfruit,Coles Summer Delight
Coles RSPCA Approved Free Range Chicken Breast Fillet Small Pack,Coles No Added Hormone Beef Porterhouse Steak With Thyme And Pepper Butter,Daley Street Dark Coffee Ground
Organic Truss Tomatoes,Coles Spinach Bunch,Coles Kitchen Caesar Salad Bowl
Herbert Adams Seasonal Garden Vegetable Pastie 4 pack,McCain Frozen Ham & Pineapple Pizza Slices 6 pack,Nexba Kombucha Rose Lemonade Live Sparkling Probiotic Multipack Bottles 330mL
Hoyts Italian Mix Herbs,Lavazza Prontissimo Intenso Instant Coffee,Coles Honeycomb Whirls Chocolate Biscuits
Boost Orange Juice With Wellmune With Pulp,Nexba Crafted Sugar Free Lemon Squash,Core Powerfoods Beef Tortolleni
Coles The Original Beef Sausages,Inglewood Farms Organic Chicken Thigh Fillets Skin Off,MasterFoods Lemon Herb & Garlic Seasoning
Charlotte's Bakery Slow Cooked Beef Pies 2 Pack,Birds Eye Frozen Cauliflower Rice,Jamiesons Run Grazier Sem Sauv Blanc 750mL
Coles Deli Thawed Raw Black Tiger Prawns,Coles RSPCA Approved Chicken Tenders Southern Fried,Coles Classic Beef Burgers
Coles Mini Croissants,Coles Bakery Iced Cupcakes,Lotte Koala's March Chocolate Biscuits
Coles Graze Grassfed Beef Scotch Fillet Steak,Three Aussie Farmers The Outback BBQ Beef & Pork Burgers,Coles Made Easy Slow Cooked Beef Brisket With American Style BBQ Sauce
Providore Premium Tomato Chilli Paste,Musashi P30 High Protein Powder Chocolate Milkshake,Guzzi's Tricolore Fettuccine Pasta
Coles The Original Beef Sausages,Coles Beechwood Smoked Picnic Ham,Steggles Turkey Breast Mince
Coles Hemp Seeds,Coles Ginger loose,Coles Smooth Blue Cheese
Coles Deli Thawed MSC Raw Lobster Tails,Coles RSPCA Approved Chicken Breast Steaks Lemon & Herb,Coles Slow Cooked Pulled Beef
Fine Foods Sesame Wafer Crackers,Arnotts Shapes Fully Load Cracker Sizzling Meatlover,Jumpy's Chicken 5 pack
Simson's Pantry Preservative Free White Mini Wraps 6 Pack,Helga's Turkish Loaf,Coles Bakery Ultimate White Chocolate Chip Cookie
Hengshun Spring Onion Ginger Cooking Wine,Ice Break Real Coffee Regular Strength Flavoured Milk,Coles Tasmanian Smoked Trout
Mount Franklin Lightly Sparkling Water Raspberry Multipack Mini Cans 6 x 250mL,Cobram Estate Extra Virgin Olive Oil Light Spray,Wild Tides Tuna Teriyaki
Olinas Pita Bites Garlic & Herb,Kb's Whiting Bites Classic Crumb,Coles Microwavable Brown Rice & Quinoa Pouch 5pack
Coles Italian Dressing,Coles Mum's Sause Bolognese,Schweppes Dry Ginger Ale Zero Sugar Classic Mixers Multipack Bottles 300mL
Big M Strawberry Flavoured Milk,Sevenly By SJP Prosecco 750mL,Don Footy Franks Skinless
Ben & Jerry Cookie Dough Peaces,Birds Eye Snap Frozen Broccoli Florets,Royal Ebi Raw Prawn Cutlet
Ocean Blue Mini Blinis,Coles Deli Thawed Squid Tubes,Drovers Beef Ribs
Coles Dairy Olive Oil Spread,Ashgrove Tasmanian Vintage Cheddar Wineglass Bay,M&M's Cookies 8 pack
Wolf Blass Red Label Chardonnay Pinot Noir NV 750mL,Pepsi Soft Drink Max Vanilla 375mL,Birds Eye Frozen Steam Fresh Fish Fillets With Thai Red Curry Sauce 2 Pack
Coles Kitchen Egg & Bacon Sandwich,Coles Kitchen Loaded Supreme Pizza,South Cape Trilogy Summer Herbs Vintage Sun Tomato Cheese
Smith's Subway Meatball Melt Taste Icons,Arnott's Original Pizza Shapes,OB Finest Gluten Free Pistachio & Fig Speciality Crackers
Coles Deli RSPCA Approved Chicken Tenderloins Thai,Coles Beef Ox Heart,Three Aussie Farmers Classic Aussie Banger Beef & Pork Sausage
Queen Unicorn Confetti Sprinkles,Nestle Mini Egg Bag,Gaganis Premium Red Rosy Split Lentils
Coles Graze Lamb Mini Shoulder Roast 2 pack,Bertocchi Yearling Corned Beef,K-Roo Kangaroo Mince
Coles Squeezie Blueberry Yoghurt Pouch,Carman's Greek Style Yoghurt & Blueberry Nut Bars 5 pack,Coles Extra Mild Olive Oil
Coles Bakery Traditional Sponge Cream Filled Iced,Coles Bakery Vanilla Creme Crown,Coles Turkish Pide
Coles Beef Family Roast,Coles Beef Chevaps,Coles Made Easy Slow Cooked Beef Brisket With American Style BBQ Sauce
On The Menu Chicken Parma With Cheesy Chips & Veg,Hanabi Mukimake Shelled Soybeans,Nestle Ice Cream Kit Kat Ice Cream Stick 4 pack
Inglewood Farms Free Range Organic Chicken Breast Fillets Skin Off,Coles Graze Lamb Leg Roast Half,Bulla Cr�me Fraiche
Cleaver's Beef Eye Fillet Steak 1-2 Pieces,Coles Made Easy Chicken Strips In Souvlaki Seasoning,Coles Lime Soft Drink
Primo Chicken Breast Thinly Sliced,Primo Manuka Honey Leg Ham,Rokeby Farms Probiotic Filmjolk Natural Yoghurt
Bulla Creamy Classic Neapolitan Ice Cream,Cadbury Dairy Milk Ice Cream Caramello 4 pack,Golden Wok Frozen Diana Chan's Thai Chicken Dumplings
Vaalia Probiotics Banana Kids Yoghurt Pouch,YoPro Yoghurt Pouch Banana,Vegie Delights Classic Hot Dogs
Devondale Extra Soft Butter Less Fat,Coles Vintage Cheese & Crackers 4 Pack,Heinz Chilli Beanz Hot
Yumi's Mini Middle Eastern Hommus 3x65g,Coles Dairy Cheese Fetta Aust Style,Coles Turkish Rolls 4 pack
Temptation Frozen Premium Tasty Cheese & Bacon Quiches 2 pack,McCain Pub Size Southern Style Chicken,Yo Chi Frozen Natural Yoghurt
Coles Organic Kent Pumpkin,Coles Dapple Dandy Plums,Coles Sweet & Salty Popcorn
Nosh Boozy Seltzer Mango Pineapple Can 330mL,Jack Daniels & No Sugar Cola Can 375mL,Gravox Traditional Salt Reduced Gravy Mix Tin
Coles Carb Neutral Beef Rib Eye Roast,Cleaver's Beef Mince Free Range Extra Lean Organic,Harvest Snaps Pea Salt & Vinegar Multipack 5x18g
Coles No Added Hormone Beef Oyster Blade Steak,Coles Deli Thawed Australian MSC Raw Banana Prawns,Ashoka Tandoori Naan Plain
Balconi Mix Max Cocoa Cakes 10 pack,Coles Bakery Apple Crumble Log,Coles Banana Muffins
I Mei Brown Sugar Pearl Milk Ice Bar 4 Pack,Proud & Punch Coconuts For Mango,Filosophy Filo Pie Feta And Leek
Coles Double Cream,Black Swan Hommus Dip,Noshu 95% Sugar Free Iced Carrot Cakes
Medjool Dates Medjol Date 5kg Gift Box,Coles Shepard Avocados,Coles Trail Mix
Richmond Valley Veal Mince,Coles Made Easy Slow Cooked Pork Ribs With Char Siu Sauce,Fehlbergs Gherkins Sweet Spiced
Coles Urban Coffee Culture Strong Beans,Sunrice Medium Grain White Rice,Preshafruit Lite Juice Apple
YoPro Frozen Dessert Cream & Berries 4 pack,Nestle Aero Hot Chocolate,Fever-Tree Premium Mixers Elderflower Tonic Water 4x200mL
Coles Corn Kernels,Coles Artisan Grazing Platter,Sanitarium Weet-Bix Bites Wild Berry Cereal
Clif Bar Crunchy Peanut Butter Bar,McKenzie's Gelatine Leaves,Campbell's Spaghetti Sauce With Minced Beef
Coles Dairy Tasty Cheese Block,The Laughing Cow Cheese,Bertolli Spread With Butter
Coles Snow Peas loose,Coles Organic Wild Rocket,Coles Almond Meal
Real Foods Original Corn Thins,Coles Long Grain Rice,Coles Pancetta
Philadelphia Light Cream Cheese Block,Cracker Barrel Extra Sharp Cheese Block,Coles Kitchen Bolognese Bake
Edgell 4 Bean Mix,Lindt Lindor Strawberries & Cream Chocolate Bag,Tic Tac Fruit
Royal Hollandia Edam,Coles Mediterranean Table Platter,Smith's Crinkle Cut Original Chips 6 pack
Coles I'M Perfect Capsicums,Coles Plums Prepacked 1kg,Market Lane Smoked Almonds
Primo Pork With Caramelised Garlic Chives Sausages,Coles Graze Extra Trim Loin Chops,The Fishery Banana Prawn Meat
Coles RSPCA Approved Free Range Chicken Thigh Large Pack,Luv A Duck Fresh Duck Breast Fillets,V2 Popcorn Bites Southern Style Plant Based
Coles Cornflour,Coles Finest Italian Grissini With Black Olive,Ivans Family Chunky Angus Pie 900g
Nutty Bruce Organic Activated Almond Milk,Chobani Greek Yogurt Coconut,Hans Leg Ham & Tomato Chutney Lunch Plate
Aussie Bodies Low Carb Choc Mint,Real Gum Plastic Free Chewing Gum Spearmint,Coles Brown Basmati Rice
Smith's Crinkle Cut Original Chips 6 pack,Mission Original White Corn Tortilla Strips,Coles Cereal Corn Flakes
Coles Finest Carbon Neutral Beef Scotch Fillet Steak,Three Aussie Farmers Louisiana Pork Sausage,Snackify White Choc Rocky Road Mix
Talley's Mussels Garlic,Coles Deli Thawed MSC Raw Aussie Oz Garlic Prawn Skewers,Coles No Added Hormone Beef Porterhouse Steak 2 Pack
Double Phoenix Premium Vermicelli Bean,Coles Mixed Herbs,Nepenthe Elevation Sparkling Cuvee 750mL
Coles Finest Pain Au Chocolate,Coles Carrot Loaf Cake,Mountain Bread Natural Wraps 8 Pack
Pampas Frozen Pastry Puff,Quorn Swedish Style Meatless Meatballs,Brilla Prosecco 750mL
Birds Eye Whiting Fish Finger,Plantry Frozen Plant Based Teriyaki Meal,Nexba Sugar Free Ice Tea Watermelon
Coles Royal Gala Apples Loose,Coles Herb Punnets Chives,Coles Vegan Fruity Almond Coconut Granola
Weis Mango & Macadamia Ice Cream Bars 4 pack,Bulla Splits Summer Splits 10 Pack,Coles Frozen Strawberries
Coles Drinking Coconut,Coles Herb Punnets Dill,Coles Kitchen Classic Salad Veggie Pasta
Burnley Brewing Summer Ale Can 355mL,Coles English Breakfast Tea Bags 50 Pack,Cadbury Dairy Milk Large Chocolate Block
Freshpak Rooibos Tea Bags 40 Pack,Arnott's Lemon Crisp Biscuits,Coles Long Grain Rice
Laucke Stoneground Rustic White,Coles Bakery Stone Baked Mini Rye Pane Di Casa,Leggo's Bolognese with Bacon Chunky Tomato & Herbs Pasta Sauce
Fresh Turmeric,Coles Superfood Mix,Coles White Chocolate Candy Speckle Ball
Tutto Pasta Gluten Free Lasagna Bolognese,Birds Eye Snap Frozen Carrot Cauliflower Broccoli & Bean,Peters Skinny Cow Vanilla Choc Peanut 4 Pack
KB Frozen Vegetable Gyoza,Moira Mac's Snackers Buffalo Mini Chicken Kebabs,Heinz American Mustard For Sausages & Hot Dogs
Helga's Wholemeal Wraps 8 pack,Mission Whole Wheat Mini Wraps 8 pack,Abbott's Bakery Harvest Seeds And Grain Bread
Wahu New Zealand Sauv Blanc 750mL,4 Pines Ultra Low Cans 4x375mL,Mrs Mac's Microwaveable Beef Pastie
Castello Double Cream Brie,Liddells Lactose Free Shredded Pizza Blend,Mayvers Extra Crunchy Natural Peanut Butter
Coles Hoki Fillets,The Cheesecake Shop Mudcake Cheesecake Ice Cream,Lindemans Bin 95 Sauvignon Blanc 750mL
Cobs Natural Popcorn Sweet & Buttery,Allen's Large Bag Candy Retro Party Mix,Coles Raisins
Coles Kitchen Creamy Ranch Salad Bowl,Coles Dutch Cream Brushed Potatoes Loose,Pepsi Multipack Cans 375mL
Coles Finest By Laurent Rye Sourdough Vienna,Coles Bakery Wholemeal Rolls,Great Temptations Oreos Cupcakes 6 Pack
Coles Prepacked Organic Beetroot,Coles Organic Butternut Pumpkin,Coles Yellow Nectarines
Sensory Lab Stellar Coffee Beans,Maltesers Extra Chocolate Snack & Share Bag,MasterFoods Garlic Powder
Coles Spicy Chilli Tuna,Ardmona Crushed Tomatoes,Coles Crumb & Cook Coconut & Kaffir Lime
Coles Kitchen Halloumi Chip,Coles Spanish Manchego,Coles Pain Au Chocolate
Coles Apple & Cinnamon Muffins,Coles White Chocolate & Raspberry Slice 5 Pack,Tip Top Burger Thins
Pana Organic Frozen Dessert Burnt Fig & Caramel,KB Gyoza Pork,Mother Razzleberry Multipack Cans 4 X 500mL
Majans Bhuja Gluten Free Ancient Grain Twists With Chia And Quinoa,Cucina Matese Gluten Free Spaghetti Pasta,Kewpie Mayonnaise Yuzu Flavour
La Espanola Extra Virgin Olive Oil,Coles Organic Snacking Tomatoes,Mars Variety Chocolate Fun Size Share Bag 20 pieces
Coles Pork Slow Cook Scotch Roast,Coles No Added Hormone Beef Rump Medallions,Norfolk Bay Wood Smoked Mussels Natural
Cadbury Freddo & Caramello Koala Large Sharepack,Coles Dark Compound Chocolate Block,Uncle Tobys Oats Quick Sachets Breakfast Cereal Original
Primo Cheese Kransky,Coles Deli Express Sliced Prosciutto,Coles Italian Whole Peeled Tomatoes
Birds Eye Carrot- Cauli & Broccoli Veggie Rice,Family Fave's Southern Style Chicken Nuggets,Coles Honey Belle Pears 750g
Coles Signature Grazing Platter,Coles Finest French 18 Month Aged Comte,Smith's Potato Chips Fun Snack Mix Variety 20 Pack
Four N Twenty Traveller Microwavable Beef Cheese & Bacon Pie,Lean Cuisine Satay Chicken Noodles,Oreo Stick Sandwich 4 Pack
Doritos Cheese Supreme Corn Chips Sharepack,Extra Peppermint Sugar Free Chewing Gum,Coles Marinated Whole Button Mushrooms With Rosemary
Kinder Bueno Mini Chocolate Bites to Share,Kellogg's Nutri-Grain Protein Breakfast Cereal,Winton Road Eden Valley Chardonnay 750mL
Chobani Greek Yogurt Natural Light,Sunny Queen Organic Eggs 12 pack,Ito En Oi Ocha Green Tea
Coles Finest Traditional Lavosh With Lemon Myrtle And Cracked Pepper,Peckish Cheese Rice Crackers,El Pozo Jamon Serrano Aged 12 Months
Coles Californian Walnuts,Asiago Sliced Porcini Mushrooms,Core Power Foods Pasta La Vista
MasterFoods Finely Crushed Garlic,Maggie Beer Pheasant Farm Pate,Primo Mount Ash Pansize Bacon
Kinder Mini Milk Easter Eggs,Celebrate Health Butter Chicken Recipe Base,Coles Water Spring Natural
Jindi Dairy Cheese Camembert,Mil Lel Extra Sharp Parmesan,Coles Kitchen Balanced Cauli Flower Pizza Base
Coles Korean Cashew And Peanut Mix,Coles Chilli & Lime Soy Crisps,Coles Organic Continental Parsley
South Cape Little Entertainers Havarti,Perfect Italiano 4 Cheese Melt,Easiyo Greek Style Unsweetened Yoghurt
Coles Bakery Iced Cupcakes,Coles Bakery Easter Ring Donut,Coles Bakery Passionfruit Decorated Pavlova
Bulla Murray Street Ice Cream Caramel Swirl & Shortbread,Coles Frozen Carrots Corn & Peas,Carlton Dry Bottle 330mL
Solo Original Lemon Thirst Crusher Multipack Cans 375mL,P.K Gold Original Chewing Gum Multipack 5x14g,Lee Kum Kee Soy Sauce
Coles Bakery High Top Half Sandwich Loaf,Primo Thin Frankfurts,Coles Natures Kitchen Vegan Chocolate Chip Cookie 4 pack
Coles Bakery Apple Crown Danish,Coles Bakery Boston Bun,Coles Chocolate Drip Cake
Ben & Jerry's Mint Chocolate Cookie,Nestle Milkybar with Baked Cookies Chocolate Block,Amys Kitchen Canned Soup Organic Mushroom Bisque
Cobs Sea Salt Gluten Free Popcorn,KB Frozen Prawn Gyoza,One Good Turn Pinot Noir 750mL
Oreo Milk Chocolate Wafer Sticks,Coles Glace Cherries,Sakata Classic BBQ Rice Crackers
Patties Frozen Party Sausage Rolls 12 pack,Coles Perform Tandoori Chicken,Boost Mango Sunshine Juice
Kettle Sea Salt & Vinegar Potato Chips,Doritos Corn Chips Cheese Supreme Flaming Hot,Arnotts Teevee Snacks Biscuits Malt Sticks
Lean Cuisine Veg'D Up Tuna Bake,Temptation Frozen Premium Tasty Cheese & Bacon Quiches 2 pack,Staminade Hydrate 25% Less Sugar Orange Powder
Coles Finest Dutch 12 Month Aged Gouda,Coles Deli Castello Blue Cheese,Cheezels Cheese Snacks Multipack 6 Pack
Coles Tomatoes Crushed Basil & Oregano,Coles Coconut Cream,Coles Finest Spanish 12 Month Aged Manchego
Chobani Oat Yogurt Vanilla,Jalna Lactose Free Whole Milk Natural Yoghurt,Pauls Zymil Vanilla Custard
Coles Bakery Stone Baked Light Rye Sourdough Vienna,Coles Bakery Margherita Tear And Share,Coles Mini Pizza Bases
Coles Spring Water 6x600mL,Mildura Sunrise Orange Fruit Drink,Celebrations Chocolate Party Gift Box
Pauls Zymil Lactose Free Full Cream Milk,Babushka's Probiotic Kefir Yoghurt Organic Natural,A2 Full Cream Instant Milk Powder
Coles Asian Choy Sum,Coles Raspberries,Market Lane Salt And Vinegar Chomp
Coles Organic Kent Pumpkin,Coles Sleeved Herbs Parsley,Coles Deli Snack Classic Coleslaw Salad Tub
Boss Vanilla Latte Coffee,Australia's Own Organic Oat Milk,Flora ProActiv Margarine Spread Buttery
Coles Joyful Muesli Bar Strawberry Cheesecake 180g,Cocon Assorted Pudding 6 Pieces,Dollar Sweets Edible Glitter Gold Spray
Coles Finest Lamb Mini Rump Roast,Beak & Sons Hickory BBQ Pork Ribs,Coles Tasmanian Salmon Portions Skin Off
Youfoodz Regular Chicken Penne With Sundried Tomato Sauce,Dari's Lentil Soup,Coles Giant Sour Cola Bottles
Coles Rolls Hamburger,Mountain Bread Rye Wraps 8 pack,Coles Deli Express Colossal Kalamata Olives
Coles Crushed Peanuts,Masterfoods Everything Eggs Spice Blend,SPC Canned Baked Beans
CC's Original Corn Chips,Old El Paso Spice Mix Lime & Jalapeno,Byron Bay Cookie Triple Choc Bites Pouch
Saxa Iodised Table Salt Shaker,Pic's Really Good Crunchy Peanut Butter,Coles Deli Temptation Pork Pie Small
Coles Soft Multigrain Sandwich Loaf,Wonder White Bread Gluten Free,Rosella Creamy Pumpkin Soup
Latina Fresh Egg Fettuccine,Coles Mozzarella Pear,Coles Iced Donuts
Jarlsberg Cheese Wedge,Vagne Comte 8 Months,Daisho Donburi Japanese Beef Rice Bowl Sauce
Weis Half & Half Pine Lime & Vanilla,Coles Irresistible Ice Cream Salted Caramel,Magnum Ice Cream Mini Almond 6Pack
Genius Gluten Free Triple Seeded Soft Rolls,Mr Kipling Angel Slice 6 pack,Helga's Traditional White Bread
Soyco Tofu Japanese Teriyaki,Royal International Tidbit Jamon Serrano,Coles Chai Latte
Coles Herb Punnets Parsley Continental,Coles Snake Beans Bunch,Coles Cranberry Sprinkle
Massel Vegetable Stock Cubes,Coles Marinade & Cook Garlic & Herb,Gullon Sugar Free Digestive Biscuits
Herb & Sons Chicken-Free Nuggets,Coles Finest Selection Pack Sausages,Ocean Blue Sliced Smoked Ocean Trout
Fresh Turmeric,Coles Mushroom Dry Shiitake,Coles Smokey BBQ Peanut & Cashews
Hedys Quiche Leek Bacon,Sakata Wholegrain Original Rice Crackers,Lindt Lindor Chocolate Heart Tin
Denada Sugar Free Ice Cream Lil Nadas Chocolate & Vanilla 4 Pack,Cadbury Dairy Milk Hazelnut Ice Cream 4 pack,Fifth Leg Semillon Sauvignon Blanc 750mL
Street Pepperoni Pizza,Charlotte's Bakery Slow Cooked Steak & Pepper Pies 2 pack,KB's Salt & Pepper Squid
Five:AM Organic Honey & Cinnamon Yoghurt,Pauls Vanilla Custard Pouch,Tarago Triple Cream
Birds Eye Deli Lightly Seasoned Squid,Birds Eye Steamfresh Fish Soy & Ginger,On The Menu Frozen Pappardelle Ragu
Coles Finest Carbon Neutral Beef Eye Fillet  Steak,Wild Oz Venison Steak,Coles Pork Bones Smoked
Coles Kitchen Vegetable Spring Rolls,Pitango Free Range Soup Chicken & Vegetable,Cremeux Blue
Peters Drumstick Ice Cream Cua Choc Cookie 4pack,Connoisseur Ice Cream Cookies & Cream 4 Pack,Cadbury Dairy Milk Mousse Cake
Coles Portobello Mushrooms,Coles Kitchen Carrot Sticks,Coles Deli Salad Tubs Snack Quinoa Tabouleah Salad
La Casa Del Formaggio Cherry Bocconcini Cheese,TLY Silken Tofu,Pampas Frozen Shortcrust Pastry Case
P.K Gold Original Chewing Gum Multipack 5x14g,Bounce Choc Mint,Nescafe 98% SF Mocha Coffee Sachets
Hamper Original Corned Beef,SPC Canned Prunes In Natural Juice,Hoyts Whole Nutmeg
Bega Cream Cheese Spread Bold,Red Rock Deli Dip Singles Caramelised French Onion 3X50G,Lorry Boys Pacific Ale Can 375mL
Coles Perform Tandoori Chicken,Sabrini Chicken Tikka With Coriander & Mint Chutney,Chai Lords 100% No Added Sugar Vanilla Chai Latte
Sanitarium So Good Chilled Original Almond Milk,A2 Light Fat Milk,Emborg French Brie Petit
