product,alt1,alt2
Coles Onions Little Tractor,Coles Organic Baby Salad Leaves Lettuce Mix,Coles Pork Belly Slices With Asian BBQ Glaze
Pureharvest Organic Natural Muesli,Coles Deli Marinated Fetta Cheese,Coles Perform Whey Protein Powder Vanilla
Mission Deli Style Tortilla Rounds,Coles Seed & Grains Rice Crackers,Ayam Thai Fried Rice Paste
KB Lemon & Pepper Squid,Connoisseur Ice Cream Vanilla Almond 4 Pack,Evans & Tate Sauvignon Blanc 750mL
Coles Dried Porcini Mushrooms,Coles Brown Mushrooms Loose,Coles Kitchen Thai Style Salad Kit
Street Supreme Pizza,Birds Eye Frozen Mild Flavour Flathead Crumb 6 Pack,Lyre's Dry London Spirit Gin Bottle
Mazzetti Organic Apple Cider Vinegar With Honey & Ginger,Ito En Oi Ocha Green Tea,Haribo Haribo Twin Snakes Sweet & Sour
Coles Bakery White Finger Buns,Mr Kipling Chocolate Slices 6 Pack,Bertocchi Hot Soppressa Salami
Birds Eye Snap Frozen Mixed Vegetables,KB's Tempura Battered Hoki Fillets,Bundaberg Diet Sarsaparilla Multipack Bottles 375mL
Bickfords Iced Caramel Coffee Syrup,Splenda Granular Sweetener,Nestle Aero Hot Chocolate
Coles Raw Sugar,Snickers Chocolate Bar Peanuts Caramel Nougat,Coles Deli RSPCA Approved Chicken Cordon Bleu
Snackboy X Denada Cookie Caramel Fudge Snack Bites 3Pack,Coles Pottle Milk Chocolate Macadamias,Ayam Premium Coconut Milk
Coles Finest Tasmanian Goats Cheese,Vegemite Spread,Coles Raw Sugar
Peters Original Twin Pole Blue Rasp Spider 8 Pack,Cadbury Dairy Milk Ice Cream Caramello 4 pack,Pensilva Estate Shiraz 750mL
Fresh Noir Perino Tomatoes,Coles Keitt Mangoes,Fresh Jalapeno Chillies
Coles RSPCA Approved Chicken Thigh Fillets Small Pack,Cleaver's Beef Rump Steak Free Range Organic,Coles Deli RSPCA Approved Chicken Breast Kebab Honey Soy
Coles Deli Salads Tub Jumbo Classic Pasta,Coles White Radish,Coles Whole Pork Leg Easy Carve Roast
Gourmet Garden Basil Cold Blended Paste,Saxa Iodised Table Salt Shaker,Vege Rice Crackers Chicken Flavour
Food For Health Nutty Almond Fruit Free Clusters,Munchme Nutritious Snack Pistachio Cranberry,Daily Juice No Added Sugar Orange Juice
Coles Plain Rice Crackers,Real Foods Original Corn Thins,Auricchio Grana Padano Basile Imports
Moondarra Cheese Honey Fig & Macadamia,Coles Kids Triangles Cheese,Yoplait Petit Miam Squeezie Strawberry Yoghurt Pouch
Helga's Spinach & Garden Herb Wraps 7 pack,Sandhurst Semi-Dried Tomato Strips,Don Skinless Thin Frankfurt's
Coles Rocky Road,Coles Finest By Laurent Black Olive And Chilli Vienna,Primo Danish Salami
Sunbeam Nuts Raw & Natural Cashews,Dollar Sweets Edible Gold Leaf,Mr D's Cola Fruit Drink Chilled
Coles Blackcurrant And Chia Bites,Gourmet Garden Lemongrass Cold Blended Paste,Coles Washed Potatoes
Sara Lee Frozen Custard Danish,Quorn Roast,Coles Frozen Fruit Sliced Strawberries
Daily Juice Orange Pre Probiotics,Sensi Prosecco DOC 18K Gold 750mL,Birds Eye Snap Frozen Vegetables Peas Corn
Easiyo Yogurt Greek Style Blueberry,Mainland Butter Soft Salt Reduced Spreadable Butter,Ottogi Noodles Jin Ramen Spicy
Coles Perino Gold Tomatoes Prepacked,Coles White Nectarines Prepacked,Coles Fresh Chillies Mixed
Coles Rainbow Cake,Tip Top White Gourmet Pizza Base 2 pack,Primo Short Cut Bacon
Coles Bakery Apple Crown Danish,Abe's Bagels Natural Bagels 4 Pack,Massel Salt Reduced Liquid Chicken Stock
Vittoria Colombia Nespresso Compatible Coffee Capsules,Nestle Sweetened Condensed Milk Tube,Campbell's Country Ladle Soup Can Rich & Creamy Pumpkin
Coles Pork Belly Roast Boneless,Coles Pork Regular Mince,Coles Caster Sugar
Coles Frozen Baby Peas,KB's Salt & Pepper Squid,Charlies Quencher Mango Orange
Coles Mud Cake Decorated,Coles Vanilla Pride Cupcakes,Coles Bakery Custard Bunlet
Coles Bakery Rustic Veggie Scone,Coles Bakery Mixed Iced Ring Donut,Coles Sweet Chilli Cheese
Cadbury Twirl Bites,Quest Protein Bar Choc Chip Cookie Dough 4X60G,Moccona Barista Reserve Medium Roast Coffee Beans
Fodmapped Roasted Pumkin Soup,Edgell Peas & Carrots,Royal International Tidbit Jamon Serrano
Peters Gluten Free Original Vanilla Ice Cream Tub,Coles Pottle Milk Chocolate Macadamias,Coles Organic Carrots Prepacked
Coles Double Chocolate Muffins,Coles Gluten Free Bagels 4 Pack,Strongbow Ultra Mango Can 330mL
Coles Kitchen Chicken Kiev Bites,Moira Mac's Snackers Buffalo Mini Chicken Kebabs,Coles Cheese Slices 84 pack
Cadbury Old Gold Roast Almond Dark Chocolate Block,Coles Ultimate Cookies 40% Choc Chip,Coles Squeezy Sauce Tomato
Lean Cuisine Chicken Cheese & Pasta,Edgell Diced Capsicum,Dose & Co. Pure Collagen Powder Unflavoured
Paldo Dosirac Noodles Beef,Shaerge Peanuts Salt,Sunny Days Sweet Co Jersey Caramel
Laurent Patisserie Lemon Meringue,Coles Bakery Apricot Crown,Taste One Pan Rustic Meatballs Recipe Base
Pringles Minis Sour Cream & Onion Potato Chips 5 pack,Smith's Crinkle Cut Original Chips 6 pack,Kettle Chilli Potato Chips
Coles Tasty Light Cheese Slices 24 Pack,Coles Parmigiano Reggiano,Jalna Lactose Free Whole Milk Natural Yoghurt
MasterFoods Dill Leaf Tips,Nature Valley Crunchy Oats & Honey Family Pack 12X42G,Fanta Orange Soft Drink Can
Coles Original Chicken Tenders,KB Panko Crumb Squid,Birds Eye Broccoli- Cauli- Garlic & Parsley Veggie Rice
Brogan's Way Everyday Salvation Gin 700mL,Frantelle Natural Spring Water 600ml,Cheetos Puffs Flaming Hot
Praise Potato Salad Dressing,Twining's Strawberry Raspberry & Loganberry Infusions Tea Bags,Original Juice Co Fruit & Veg Goodness Green
The Butchers Cellar Cabernet Sauvignon 750mL,Brick Lane One Love Pale Ale Can 355mL,Coles Made Easy Prosciutto Wrapped Chicken Breasts With Parmigiana Stuffing
B Honey Glass,Wellness Road Organic Cacao Powder,Bacardi Mojito Can 250mL
Uncle Tobys Chewy Bars Choc Chip,Oreo Creme Biscuits Double Stuff,Royal Hollandia Edam
Provedore Felino Salami Garlic,Captain's Table Classic Water Crackers,Nutella Hazelnut Spread With Cocoa
Nando's Medium Peri-Peri Marinade,Pop Tops Apple Blackcurrant Fruit Drink Multipack 250mL,Nestle Tex Bar
Coles Roasted & Salted Pistachios,Coles Green Cucumber,Coles Salad Medium Tubs Potato Egg & Bacon Salad Salad
Valley Produce Co. Flatbread Sea Salt & Sesame Artisan Crackers,Coles Corn Kernels,Ferrero Rocher Heart Chocolate Gift Box 8 Pieces
Britannia Little Hearts,Genius Glg GLG Tiger Bloomer Loaf,Cadbury Dairy Milk Ice Cream Caramello 4 pack
Coles Frozen Onions Chopped,McCain Frozen Onion Rings,Kawan Plain Paratha
Streets Golden Gaytime Bites Chocolate,McCain Frozen Ham & Pineapple Family Pizza,Athletic Brewing Company Run Wild Non Alcholic Beer 6x355mL
Coles Frozen Convenience Meal With Macaroni Cheese,Annabel Karmel Meals Cottage Pie,Great Northern Original Lager Bottle 330mL
Coles Grill Lamb Ribs In A Sticky BBQ Rub,Tassal Salmon Portions Skin On,Coles Orange Jelly Cups 4 Pack
Arnott's Malt-O-Milk Biscuits,Muscle Nation Custard Casein Protein Powder Cookies & Cream,100 Plus Isotonic Drink Can
Coles Dairy Olive Oil Spread,Coles Lite Reduced Fat Milk,Dr Schar Crackers
Coles Hoki Fillets,Fry's Frozen Meat Free Sausage Rolls 4 Pieces,Streets Blue Ribbon Duo Chocolate Affair
Coles Deli Thawed Raw Peeled Prawn Meat,Tassal Tasmanian Smoked Salmon,Coles Graze Lamb Boneless Shoulder Roast With Mountain Pepper- Murray River Salt And Lemon Myrtle
Sodastream Mount Dew Flavour Mix,Fanta Orange No Sugar Soft Drink Multipack Bottles 12x300mL,The Cheesecake Shop Mudcake Cheesecake Ice Cream
Coles Finest Macaron Selection,Coles Bakery Mixed Iced Ring Donut,Coles Croissants 12 Pack
Market Lane Choice Fruit Nut Mix,Coles Vegan Fruity Almond Coconut Granola,Coles Deli Salads Tub Medium Classic Potato
Grainwaves Sour Cream Chives Sunbites 5 Pack,Fantastic Chicken Noodle Cup,Eclipse Peppermint Sugar Free Mints Tin
Coles Organic Coriander Bunch,Coles Organic Carrots Prepacked,Coles Deluxe Natural Mixed Nuts
Coles Seaweed Rice Crackers,Coles Marinated Whole Button Mushrooms With Rosemary,Grant Burge 5th Generation Barossa Shiraz 750mL
Coles RSPCA Approved Whole Boneless Chicken With Asian BBQ Seasoning,Coles Beef Roast & Onion Garlic & Red Wine Rub,Coles Deli Thawed Peeled Chilli Prawns
On The Menu Frozen Pappardelle Ragu,Hanabi Cabbage & Pork Dumplings,Furphy Refreshing Ale Bottle 375mL
Drumstick Ice Cream Cua Hokey Pokey 4pack,King Of Kings Takoyaki Octopus Balls,Mr Finch Cider Rose Bottle 330mL
Maxines Burn Burn Cookies & Cream Bar,Bulla Creamy Classic Ice Cream Sticks Vanilla 4 Pack,MasterFoods Ground Extra Hot Cayenne Pepper
Masterfoods Everything Eggs Spice Blend,Equal Sweetener Sachets,Coles Choc Peanut Butter
Coles Butter Leaf Blend,Fresh Green Cayenne Chillies,Coles Honey & Dijon Soy Crisps
Coles Veg Pad Thai,McCain Pub Size Loaded Parma BBQ Meatlovers,Bulla Creamy Classics Vanilla Ice Cream Tub
The Organic Milk Co Organic Cheddar Block,Jalna Lactose Free Yoghurt Vanilla,Black Swan Spicy Capsicum Dip
Coles Kitchen Thai Style Salad Kit,Coles Organic Kale With Vegetables,Coles Baby Cucumbers
Coles Beetroot Bunch,Coles Asian Choy Buk,Coles Pottle Roasted Salted Macadamias
Coles Happy Birthday Edible Cake Plaque,Coles Glitter Hip Hip Hooray Acrylic Plaque Small,Coles Bakery Madeira Cake
Coles RSPCA Approved Chicken Drumstick Fillets Sweet Chilli,Coles Slow Cooked Pulled Chicken,Coles RSPCA Approved Free Range Chicken Breast Large Pack
Hanabi Surimi Crispy Tofu Balls,Coles Corn Fritters 10 Pack,Maltesers Milk Chocolate Party Gift Box
Coles Australian Smokey Individually Wrapped Slices 12 Pack,Mainland Vintage Cheese Block,Coles Dairy Hommus Dip
Coles Party 30 Pack,Meet Meetballs,Birds Eye Snap Frozen Sliced Green Beans
Coles Deli Salads Tub Medium Classic Potato,Coles Deli Small Greek Salad,Market Lane Salt And Vinegar Chomp
Snackboy Loving Earth Dark Chocolate Hazelnut Dessert,Sara Lee Cookie Pies Dble Choc & Slt Cara 4pk,Plantry Frozen Plant Based Meal Spaghetti Bolognese
Coles Spinach Bunch,Coles Deli Salads Tub Snack Classic Potato,Coles Chocolate Turkish Delight
St Hallett Blockhead Shiraz 750mL,Campbells Real Soup Digest Sweet Potato Carrot & Coconut,Cadbury Dairy Milk Marble Chocolate Block
Coles Carb Neutral Beef Rib Eye Roast,Dineamic Slow Cooked Lamb & Veg,Lurpak Unsalted Butter
Toscano Gluten Free Pizza Base,Helga's Wholemeal Wraps 8 pack,Coles Bakery Anzac Biscuits
Danone Yopro Strawberry Yoghurt Tub,Pauls Custard Vanilla Bean,Dr Schar Crackers
Coles Bakery By Laurent Ciabatta Loaf,Helga's Turkish Loaf,Coles Bakery Madeira Cake
Coles Frozen Pastry Puff Sheet Ready Rolled 6 Pack,I&J The Finest Frozen Basa Fillets,Makers Mark Kentucky Straight Bourbon Whisky 1L
Coles Organic Coriander Bunch,Fresh Habanero Chillies,Coles Organic Carrots Prepacked
Peters Drumstick Minis Vanilla Ice Cream 6 pack,Juicies Tropical 10 Pack,Bickford's Diet Lime Cordial
Connoisseur Ice Cream Chocolate Brownie Custard,Bulla Murray Street Ice Cream Chocolate & Fudge Ripple,Steggles Frozen Crumbed Chicken Nuggets
Dineamic Beef Chilli Con Carne Pouch,Coles Kitchen Chicken In Creamy White Wine Sauce Pouch,M&M's Cookies 8 pack
Coles Beef Eye Fillet Steak,Coles Finest Carbon Neutral Beef Slow Cook Chuck Roast,Coles Deli RSPCA Approved Chicken Wings
Coles Yellow Nectarines,Coles Red Globe Seeded Grapes,Coles Organic Beetroot Prepacked
Nudie Nothing But Carrot Apple Orange & Ginger Juice,Oak Iced Coffee Flavoured Milk,Nescafe Hazelnut Latte Coffee Sachets
Bickfords Pineapple Mango Juice,Smirnoff Red Vodka 700mL,Ben & Jerrys Topped PB Overtop
Lindt Excellence 78% Cocoa Dark Chocolate Block,Nestle Aero Caramel Gold Hot Chocolate,Connoisseur Ice Cream Mini Salted Caramel & Macadamia 6 Pack
Coles Deli RSPCA Approved Chicken Garlic Kyiv,Inglewood Organic Honey Soy Chicken Nibbles,Coles Deli Thawed Australian MSC Blue Grenadier Fillet
Coles Gnocchi,Coles Organic Beans Chick Peas,Nestle Block Chocolate Aero Orange
Coles Bakery Super Soft Round Rolls,MEB Pita Souvlaki,Coles Happy Birthday Acrylic Plaque Gold & Silver Small
Coles Brushed Baby Potato,Coles Kitchen Caesar Salad Kit,Coles White Chocolate Candy Speckle Ball
Coles Pork Kiev With Katsu Sauce,K-Roo Kangaroo Herb and Garlic Marinated Steak,Tassal Hot Smoked Salmon Cracked Peppercorn
Beechworth Bee Raw Honey & Honeycomb,Ashgrove Three Peaks Tassie Trio Cheese,Gotzinger Cheese Kransky
Coles I'M Free From Focaccia,Liberate Gluten Free Crumpet,Coles Bakery Cake Madeira Lemon
Yoplait Berry Punnet Yoghurt 100g,Coles Skim Milk Bottle,Gippsland Dairy Cookies & Cream Mix-Ins
Coles Made Easy Slow Cooked Boneless Pork Shank With Caramel & Apple Sauce,Coles Organic Beef Scotch Fillet,Coles Tasmanian Salmon Portions Skin On
Soyco Tofu Thai,Thomson's Deli Streaky Bacon,A2 Light Milk
Cleaver's Beef Mince Free Range Organic,Coles Made Easy Slow Cooked Pork Belly,V2 Burger Plant Based 4 Pack
Chobani Minis Yogurt Blue Wahoo Blueberry Blackberry Pouch,Yakult Gluten Free Fermented Milk Drink 10 pack,Philadelphia Sweet Chilli Pourover Dip
Coles Tasmanian Salmon Portions With Lemon & Herb Crumb,Norfolk Bay Wood Smoked Mussels Natural,Coles Deli Fresh Saddletail Snapper Fillet
The Kraken Black Mojito Can 330mL,Pepsi Max Multipack Mini Cans 200mL,Coles Pacific Tuna In Olive Oil
Coles Baby Rocket,Coles Kitchen Pasta Salad,Coles Sliced Mushrooms
Pana Organic Frozen Dessert Chocolate Hazelnut,Pana Organic Frozen Dessert Salted Choc & Caramel,Connoisseur Ice Cream Vanilla Caramel Brownie
Coles Margherita Pizza,Connoisseur Ice Cream Mint Cookies 4 Pack,Coles Urban Coffee Culture Medium Roast Beans
Coles Tuna Sandwich Olive Oil Blend,Coles Table Salt,Ivans Family Chick Mush Leek Pie 900g
Hans Mild Twiggy Sticks,Hans Grazing Platter Danish Salami Cabanossi & Apricots,Arnott's Original Salada
Coles RSPCA Approved Butter Chicken With Long Grain Rice,On The Menu Frozen Beer Battered Fish & Chips,Pitango Soup Tomato Basil
Flora ProActiv Margarine Spread Original,Coles Smooth Ricotta,I&J Original Crumb Fish Fillets
Coles RSPCA Approved Free Range Chicken Breast Large Pack,Coles Pork Slow Cook Scotch Roast,Coles Organic Baby Cos Lettuce
Coles Baby Beetroot Prepacked,Coles Red Plums Loose,Nando's Hot Peri-peri Chilli Sauce
Rocco's Vienna Style Frankfurters,Coles Graze Lamb Boneless Shoulder Roast With Mountain Pepper- Murray River Salt And Lemon Myrtle,Coles Deli Thawed Prawn Skewers Sweet Chilli
Coles Beef Porterhouse Thin Cut,Slow Hills Free Range RSPCA Approved Chicken Drumsticks,Coles No Added Hormone Beef Marrow Bones
Coles Finest By Laurent Rye Sourdough Vienna,Coles IM Free From White Wraps,Coles Chocolate Mini Cupcakes 9 pack
Coles Citrus Fruit And Nut,Coles Raw Power,Coles Red Chillies
MEB Pita Pockets White 6 pack,Mission Souvlaki Bread,Coles Party Candles Spot
Glico Pocky Green Tea Matcha Biscuit Sticks,Whittaker's Berry Forest Block Chocolate,Sunrice Creepy Cheese Mini Bites 8pk
A2 Light Fat Milk,Red Tractor Green Banana Multi Fibre Powder,Coles Bakery BBQ Cheese And Bacon Pizza Roll
Four N Twenty Traveller Microwavable Beef Cheese & Bacon Pie,Hanabi Prawn & Pork Potstickers,Johnnie Walker Red Label Scotch Whisky 1L
Nongshim Kimchi Ramyun Noodle Soup 5 Pack,Olympian Sesame Biscota,Sodastream Soda Flavours Lime
Massel Beef Stock Powder,Australian Inter Foods Hash Brown,Kellogg's LCMs Puffed Rice Snack Bars Variety 15 Pack
Coles Sweet Chilli Chicken Tenders,Pan Ducale Bastoncini Almond Biscuits,Heineken Can 500mL
Simson's Pantry Low Carb Garlic & Herb + Protein,Meb Khobz Hi Protein Low Carb 4 pack,Coles Slow Cooked Pulled Chicken
Coles Boneless Pork Leg Roast,V2 Sausage Spicy Spanish Plant Based 6 Pack,Maynards Original Wine Gums Mini
Coles Deli Thawed Peeled Garlic Prawns,Ocean Blue Sliced Smoked Salmon,Coles RSPCA Approved Free Range Chicken Thigh Cutlets
MasterFoods Tomato Sauce,Coles Extra Virgin Olive Oil Spray,Coles Deli Express Sliced Prosciutto
Coles Brushed Potatoes,Coles Green Kiwifruit,Coles Sherbert Fizzies
Dare Iced Coffee Espresso Flavoured Milk,Pauls Chocolate Custard Pouch,Bulla Sour Cream
King Island Dairy Stokes Point Smoked Cheddar Cheese,Devondale Salted Butter,Coles Kitchen Hoisin Pork Springroll
Coles Graze Grassfed Beef Scotch Fillet Steak,Norfolk Bay Wood Smoked Mussels Garlic,The Lady Shake Meal Replacement Variety 14 Pack
Coles Baby Carrots Prepacked,Golden Circle Sliced Beetroot,Smirnoff Ice Double Black Can 375mL
Continental Cup A Soup Creamy Mushroom with Croutons 2 pack,Deb Instant Mashed Plain Potato,Cadbury Freddo Delicious Biscuits Dipped In Milk Chocolate
Future Farm Future Mince,Coles Beef 3 Star Regular Mince,Future Farm Future Meatballs
Coles Specialty White Seedless Grapes Prepacked,Coles Half Papaw,Coles Salted Caramel Trio
Provedore Felino Salami Garlic,Coles Deli Vine Leaves Stuffed Dolmades,OB Finest Gluten Free Pistachio & Fig Speciality Crackers
Cleaver's Beef Porterhouse Steak Organic,Coles Free Range Pork Belly Slices 11X5,Coles RSPCA Approved Chicken & Cheese Burgers
Fresh Turmeric,Coles Organic Chopped Kale,Coles Blackcurrant And Chia Bites
Coles Tomatoes Australian Diced,Coles Long Grain White Rice,Allen's Killer Pythons
Coles No Added Hormone Beef Short Rib Fingers,Coles No Added Hormone Beef Scotch Steak With Truffle Butter,Farmer Jo Gluten Free Keto Granola
Coles Organic Beef Scotch Fillet,Herb & Sons Beef-Free Mince,Three Aussie Farmers The Outback BBQ Beef & Pork Burgers
Pauls Vanilla Custard,Haagen Dazs Signature Collection Ice Cream Mini Cups 4 Pack,Evian Natural Mineral Water
Coles Lamb Leg Butterflied With Rosemary & Garlic Marinade,Coles Deli Thawed Raw Whole Gulf Squid,V2 Mince Chicken Style Plant Based
Arnott's Chicken Crimpy Shapes,Nongshim Ramyun Noodle Soup 5 Pack,Ferrero Rocher Heart Chocolate Gift Box 8 Pieces
Don Shredded Ham,Bertocchi Regular Mortadella,Maltesers Gold Choc Snack & Share Bag
Coles Vanilla Slice 2 pack,Coles Bakery Cake Madeira Lemon,Abe's Bagels Low Carb 4 pack
Coles Yellow Squash loose,Coles Sweet Corn,Coles Whole Pork Leg Easy Carve Roast
Coles Free Range Pork Loin Medallions,Coles Lamb Leg Butterflied,Coles Deli Thawed Raw Whole Gulf Squid
MEB Pita Pockets White 6 pack,Coles Tiramisu,Bertocchi Regular Mortadella
S&W Cage Free Mayonnaise,Kikkoman Gluten Free Soy Sauce,The Stubborn Few Pinot Gris Cask 2Litre
Bega Light Crunchy Peanut Butter,Gravox Diane Sauce Liquid Pouch,Jordans Granola Low Sugar Strawberry & Seeds
Coles Celery Sticks Prepacked,Coles Organic Sweet Corn,Coles Half Savoy Cabbage
Coles Beef Graze Grass Fed Roast Slow Cook,Coles Free Range Pork Loin Chops,Luv A Duck Cooked Duck Breast Peking Flavoured
Coles William Pears 1kg,Coles Oranges Valencia,Coles Herb Punnets Lime Leaves
Flora ProActiv Margarine Spread Buttery,Coles Chick Peas,Schweppes Zero Sugar Ginger Ale  Mixers
Smith's Crinkle Original Potato Chips,Smith's Crinkle Cut Original Chips 6 pack,OB Finest Natural Sourdough Crispbread
Arnott's Arrowroot Milk Biscuits,180 Degrees Maple Cranberry Apricot Oat Crackers,La Molisana Farina 00 Di Grano Tenero Flour
Jarlsberg Original Cheese Block,Coles Marinated Danish Fetta,Coles Perform Chicken Pesto Gnocchi
Coles RSPCA Approved Thai Green Chicken Curry with Long Grain Rice,McCain Pub Size Bangers & Mash,Denada Double Choc Ice Cream Tub
Minor Figures Barista Oat Milk,Chobani Greek Yogurt Raspberry,Black Swan Warming Cheesy Garlic & Herb Dip
Grant Burge Pinot Noir Chardonnay NV 750mL,XXXX Gold Block Can 375mL,KB Salt & Pepper Squid
180 Degrees Walnut Oat Crackers,180 Degrees Parmesan Oat Crackers,Valley Produce Co. Vegetable Flatbread  Beetroot Artisan Crackers
Sungrow Medium Grain White Rice,Wild Tides Responsibly Fished Tuna Thai Green Curry Mild,Skittles Fruits Chewy Lollies Party Share Bag 12 Pieces
The Cheesecake Shop Mudcake Cheesecake Ice Cream,Carman's Natural Bircher Muesli,Moet & Chandon Rose Brut NV 750mL
Coles White Plain Flour,Coles Tomatoes Australian Diced,Coles Finest Traditional Lavosh With Sea Salt
Myojo Chicken Abalone Flavour Noodles 5 Pack,Don Alvaraz Manchego,Nestle Kit Kat Smooth Hazelnut 4 Finger
Ipastai Basil Pesto,Coles Finest Restaurant Collection Chinese Crispy Pork Bao Kit,Hunt & Brew Cold Brew Coffee Colombia
Darrell Lea Choc Mega Balls Mint,Cadbury Humpty Easter Eggs Carton,Miso Tasty White Miso Paste
Coles Dollop Cream,Coles Pro-B  Milk Drink Fermented,Five:AM Organic Honey & Cinnamon Yoghurt
Werther's Original Cream Candies No Sugar Added,Coles LSA Mix,Beyond the Wilderness Chardonnay 750mL
T2 Relax,St Hallett Faith Shiraz 750mL,Coles Nougat Cranberry & Nut
Petuna Deli Fresh Salmon Portions Skin On Tray,Coles Deli Thawed Prawn Skewers Garlic,Coles Lamb Cutlets
Pablo & Pedro Tempranillo 750mL,Baileys Australian Rivermint Chocolate Liqueur 700mL,KB Gyoza Pork
Coles Rice Wine Vinegar,Cobram Estate Extra Virgin Olive Oil Light Spray,CC's Cornados Sour Cream & Chives
Coles Apple Fruit Drink 250mL,Youfoods Getcha Greens,Balter Eazy Hazy Can 375mL
Coles Bakery Chocolate Cream Filled Profiteroles,Noshu 95% Sugar Free Birthday Cake Donut,Genius Gluten Free Soft White Rolls
Coles Salted Caramel Almonds & Pecans,Coles Soy Crisps,CC's Cornados Sour Cream & Chives
Coles Keitt Mangoes,Fresh Purple Eggplant,Coles Deli Salads Tub Jumbo Classic Pasta
Hanabi White Clams Whole,Peters Frosty Fruits Tropical 8 pack,Yalumba Y Series Pinot Grigio 750mL
Fresh Habanero Chillies,Bean Shoots Prepacked,Market Lane Lines Honey Nut Medley
Coles Long Grain White Rice,Fragassi Arrabbiata Pasta Sauce,Jalna Farm To Pot Organic Yoghurt Vanilla
Coles Kestrel Potatoes Prepacked,Coles Medjool Dates loose,Coles Beef 3 Star Regular Mince
Cottee's Breakfast Marmalade Jam,Bonvit Tea Bags Dandelion,Annalisa 4 Bean Mix
Cobs Popcorn Sea Salt 5 Pack,Pringles Sour Cream & Onion Potato Chips,Extra Peppermint Sugar Free Chewing Gum
Coles Dutch Carrots,Coles Deli Salad Large Tubs Potato Egg & Bacon,Coles Superboost Pottle
Coles Half Drumhead Cabbage,Coles Kitchen Classic Pasta Salad,Coles Dark Chocolate Ginger
Coles Cheese Rolls,Coles Bakery Stone Baked By Laurent Sourdough Baguette,Batchelors Chip Shop Style Mushy Peas
Delicias Quince Paste,La Casa Del Formaggio Reduced Fat Ricotta,Thins Original Potato Chips
Coles Super Nutty Low Sugar Granola,Coles Royal Gala Apples 1Kg,Coles Kitchen Caesar Salad Bowl
Coles Frozen Party Sausage Rolls 24 Pack,Coles Perform Lemon Pepper Chicken,M&Ms Peanut Milk Chocolate Snack & Share Party Bag
Coles Deli Thawed Raw Whole Gulf Squid,Coles Finest Hot & Spicy Beef Burgers 2 Pack,Aeroplane Lite Lime Jelly Crystals 2 pack
Yarra Valley Dairy Wrap Brie,Coles Regular Cream Cheese Block,Pitango Soup Creamy Pumpkin Coconut
Coles Durum Wheat Pasta Large Spirals,Coles Deli Express Italian Style Sliced Salami,Grainwaves Sour Cream & Chives Wholegrain Chips
Lilydale Butterflied Boneless Chicken Jamacian Jerk,Coles No Added Hormone Beef Steak Crumbed,Tassal Salmon Portions Skin On
Raguletto Red Wine & Garlic Pasta Sauce,The Juice Lab Wellness Shot Focus,Cadbury Dairy Milk Freddo Strawberry Sharepack
Vittoria Black Valley Nespresso Compatible Coffee Capsules,Vittoria Latte Beans Coffee,Mc Ilhenny Co. Tabasco Sauce
Bubble Milk Tea Brown Sugar With Tapioca Pearls,Pauls Physical High Calcium Reduced Fat Milk Carton,Coles Hot Cross Buns Traditional Mini Fruit
Coles Nature's Kitchen Smokey Potato Black Bean Sausages,Coles Finest By Laurent 7 Seed & Grain Vienna,Smith's Baked Sweet Chilli And Sour Cream
Maggi Stir Fry Creations Teriyaki & Sesame Chicken,Hedys Quiche Leek Bacon,Coles Chillies Ground Hot
Dare Mocha Iced Coffee,Dare Double Espresso Iced Coffee,Coles Fresh Loose Cup Mushrooms
Sunbites Caramelised Onion & Balsamic Snack Crackers,Carman's Natural 5 Grain & Super Seed Gourmet Porridge Sachets,Sanpellegrino Pet Sparkling Mineral Water Bottle
Wonder White Bread Gluten Free,Coles Soft Multigrain Sandwich Loaf,Cadbury Mini Egg Cake 6pack
Scoop & Weigh Superfood Dragon Fruit Smoothie Powder,Gourmet Garden Basil Cold Blended Paste,Coles Kitchen Pasta Salad
Carman's Low Sugar Low Carb Bars Honeycomb Crunch 120g,Uncle Tobys Chewy Muesli Bars White Choc Chip 6 Pack,Madura Green Tea Bags 50 pack
La Fournee Doree Brioche Burger Buns With Sesame Seeds 4 Pack,Coles Bakery Stone Baked Mini Rustic Baguette,Bertocchi Natural Hickory Smoked Leg Ham
Spud Lite Potatoes Prepacked,Coles Green Kiwifruit,Coles Kitchen Classic Slaw Salad Family Kit
Coles Finest Lamb Garlic And Oregano Sausages,Coles Made Easy Moroccan Lamb Filo Rolls With Fetta & Pumpkin,Coles Rolled Oats
Youfoodz Honey Mustard Chicken With Garlic Veg,Vegie Delights Soy Sausages Vegie,Devondale Full Cream Long Life Milk
Mission Original Yellow Corn Tortilla Strips,Inglewood Farms Organic Chicken Thigh Fillets Skin Off,Golden Circle Pineapple Crushed in Syrup
Mars Chocolate Bar with Nougat & Caramel,Nice & Natural Fruit Unicorn Raspberry Orange,Gravox Traditional Gravy Mix
Nudie Pink Lemonade Juice,Roseline Rose Prestige 750mL,Quorn Frozen Vegan Nuggets
Delverde Fusilli Pasta,Coles Kestrel Potatoes Prepacked,James Busby Margaret River Rose 750mL
Starbucks Ndg Capsules Pike Place,Uncle Tobys Oats Delicious Blends Raspberry Roasted Almond & Vanilla,Johnnie Walker Black Label 12YO Scotch Whisky 700mL
Aperol Spritz Bottle 175mL,Campo Viejo Tempranillo 750mL,Twinings Green Tea & Lemon Tea Bags
Lipton Ice Drink Tea Lemon No Sugar,Edgell Nourish Chemoula Veg Rice Bowl,Coles Coffee Machine Descaler
Ashoka Tandoori Naan Garlic,Filosophy Mini Spirals Spinach And Feta,Jarrah Hot Dark Chocolate
Coles Sponge Unfilled Rectangular,Coles New York Style Baked Cheesecake Slice 2 Pack,Coles Vanilla Pride Cupcakes
Beijing Sliced Garlic Tofu Pieces,Coles Perform Butter Chicken,Oak Plus No Added Sugar Vanilla Flavoured Milk With 30g Protein
Gourmet Garden Italian Herbs Cold Blended Paste,Coles Kitchen 8 Leaf Blend,Truly Watermelon & Kiwi Seltzer Can 330ml
Best Foods Real Mayonnaise,Heinz Seriously Good Garlic Lovers Aioli Mayonniase,Cadbury Caramilk Easter Eggs Bag
