product,alt1,alt2
Cremorn St Bakers Double Chocolate Cake 5'',Coles Bakery Custard Filled Profiteroles,Patak's Tikka Masala Simmer Sauce Medium
Wonder White Bread Wholegrain Smooth,Family Fave's Chicken Chips With Ciabatta Crumb,Fehlbeergs Martini Flavoured Green Olives
Coles Kitchen Green Goddess Dressing,Coles Natural Cashews,Coles Brown Mushrooms Loose
Red Rock Deli Capsicum And Basil Dips,Red Rock Deli Beetroot And Feta Dips,Coles Finest Restaurant Collection Spanish Style Meatballs
Coles Free Range Eggs 6 Pack,Mylife Biocheese Cheddar Ham And Crackers,Olive Grove Classic Olive Oil Margarine Tub
Coles Shredded Roast Chicken Breast,South Cape Little Entertainers Havarti,Dollar Sweets Extra Strong Peppermints
Coles Deli Salad Tubs Large Quinoa Tabouleh,Coles Kitchen Shredded Carrot,Coles Roma Tomatoes Loose
Arnott's Minis Choc Chip Cookies 7 pack,Cadbury Caramilk Hokey Pokey Chocolate Block,Coles Jelly Crystals Raspberry Flavoured
Four N Twenty Angus Beef Cheese & Bacon Pies,Continental Sensation Mushroom Bacon Soup Serves 2,Cadbury Dairy Milk Fruit And Nut Large Chocolate Block
Coles Monterey Jack Cheese Slices,Perfect Italiano Mexican Blend Grated Cheese,Veef Plant Based Meat Balls With Tomato Sauce
Coles RSPCA Approved Chicken Mince,Lilydale Butterflied Boneless Chicken Jamacian Jerk,Drovers Beef Ribs
Coles Hot Cross Buns Premium Fruit,Mr Donut Iced Chocolate Jam Donuts,Coles Deli Express Split Green Olives
Darrel Lea Life Savers Musk & Raspberry Block,Queen Victoria Lemon & Ginger Tea Bags,Mission Mini Sliders 5 pack
Queen Natural Vanilla Concentrated Extract,MasterFoods Taco Seasoning,Lo Bros Kombucha Pineapple Lime
John West West Protein + Calcium Tuna Springwater,Maggi Dry Recipe Base Beef Stroganoff,Arnott's Teddy Bear Biscuits
Coles No Added Hormone Beef Brisket Slow Cook,Coles RSPCA Approved Half Split Chicken With Peri Peri Marinade,Cleaver's Beef Sausages Paleo Gluten Free Organic
Coles Brussels Sprouts Prepack,Coles Organic Chopped Kale,Coles Dark Choc Apricot Nougat
Lilydale Free Range Chicken Tenderloins,Coles Free Range Pork Mince,Coles No Added Hormone Beef Steak Crumbed
I&J Original Crumb Fish Fillets,Barilla Collezione Samolina Lasagne,Gelatissimo Gelato Italian Hazelnut
Tip Top Cafe Bread Raisin Toast,Coles Kitchen Quiche Lorraine 2 pack,Coles Dairy Tasty Light Cheese Block
Coles Artisan Grazing Platter,180 Degrees Cheese Bites,Coles Rice Jasmine
Coles Red Royale Washed Potatoes Prepacked,San Remo Single Snack Macaroni Cheese Pasta & Sauce,Coles Made Easy Slow Cooked Lamb Shoulder In Tandoori Sauce
180 Degrees Walnut Oat Crackers,OB Finest Fig Fruit Paste,Freshpak Rooibos Tea Bags 40 Pack
KB's Himalayan Salt & Pepper Crumb Hoki Fillets,Four N Twenty Meat Free Pie,Smithy's Bitter Can 375mL
Rocco's Vienna Style Frankfurters,Coles Graze Grass Fed No Added Hormone Oyster Blade Thin Sliced Steak,Coles RSPCA Approved Garlic And Herb Chicken Schnitzel
Stoneleigh Marlborough Sauvignon Blanc 750mL,Lo Bros Kombucha Passionfruit,Ribena Blackcurrant Fruit Juice Syrup Bottle
Kettle Avocado Oil Lime With A Hint Of Chill,Continental Curried Sausages Recipe Base Serves 4,Wolf Of The Willows PUP Can 355mL
Sonoma Baking Indulgent Fruit And Spice Hot Cross Buns 4 pack,Coles Finest By Laurent White Sourdough Rolls,Bertocchi Mild Soppressa Salami
OB Finest Entertaining Pack,Coles Deli Express Double Smoked Ham,Coles Australian Made Bacon Rashers
Coles Oranges Valencia,Coles White Nectarines Prepacked,Coles Baby Spinach
Coles No Added Hormone Beef Porterhouse Steak 2 Pack,K-Roo Kangaroo Sizzle Steak,Coles Hot Smoked Salmon Cracked Pepper
Coles Bakery Berry Chocolate Decorated Pavlova,Coles Wholemeal & Grain Soft Wraps 8 Pack,Vegie Delights Plant Based Vegan Lentil Burger  4 Pack
Mission Spinach & Herb Wraps 8 pack,Coles Fantasy Cupcakes 4 Pack,Bertocchi Regular Mortadella
Olympian Almond Crescents Kourambies Greek Biscuits,Kialla Organic Vegan Pancake Mix Vanilla,Mayvers Smunchy Natural Almond Butter
Coles Herb Punnets Lime Leaves,Coles Medjool Dates loose,Coles White Peaches Prepacked
Coles Watermelon Seedless Whole,Coles Herb Punnets Chives,Coles Deli Salad Tubs Jumbo Quinoa Tabouleh Salad
Coles Herb Tarragon Punnet,Coles Green Cucumber,Coles Purple Baby Broccoli
Arnott's Cheese & Bacon Shapes,Coles Fruity Bites Platter,Ardmona Crushed Tomatoes
Coles White Seedless Grapes,Coles Herb Thai Basil Punnet,Coles Kitchen Family Coleslaw Kit
La Casa Del Formaggio Mozzarella Ball,Jalna Pot Set Coconut Yoghurt,Provedore Garlic & Fennel Salami
Coles Hot Smoked Salmon Natural,Coles Deli Thawed Cooked Peeled Prawn Cutlets,Birds Eye Veggie Rice Cauliflower Fried Rice
Soothers Butter-Menthol Medicated Throat Lozenges,Fanta Orange Soft Drink Bottle,SPC Two Fruits 25% Less Sugar
Devondale Extra Soft Butter Less Fat,Yumi's Gluten Free Classic Sweet Potato & Roasted Cashews Dip,Green's Orange Poppyseed Cake Mix
Coles Squeezie Blueberry Yoghurt Pouch,Mainland Munchables Tasty Cheese & Crackers 4 pack,Get Plant'd Vegan Roast Pork
Indomie Fried Mi Goreng Instant Noodles 5 Pack,John West Tempters Chilli Tuna,Red Rock Deli Capsicum And Basil Dips
Coles Baby Leaf Salad & Beetroot,Coles Vitality,Coles Peanut Butter Jar
V2 Tenders Southern Style Plant Based 6 Pack,British Family Pack Thin Pork Sausages,Banrock Station Pink Moscato 750mL
Farmers Union Plus Yoghurt Mango,Obela Singles Tzatziki Classic 3X60G,San Remo Trivelle Spirals No 17
Ivans Family Chunky Angus Pie 900g,Bare Bones Classic Gravy With Black Garlic,Coles Green Smoothie
Coles RSPCA Approved Chicken Breast Schnitzel Garlic & Herb Crumb,Coles Deli RSPCA Approved Chicken Breast Satay Style Kebab,Norfolk Bay Wood Smoked Mussels Garlic
Coles White Nectarines,Coles Topless Pineapple Half,Coles Natural Cashews
Helgas 50% Lower Carb 5 Seeds Loaf,Coles Bakery Apple Crumble Scroll,Coles Iced Extra Chocolate Donuts
D'Orsogna Pepperoni,Ardmona Crushed Tomatoes,CSR Raw Sugar
Coles Deli Thawed Prawn Skewers Sweet Chilli,Coles Beef Rissole Pasties With Tomato Sauce,Lilydale Free Range Chicken Breast Fillets Small Pack
Coles Deli RSPCA Approved Chicken Tenderloins Thai,Coles No Added Hormone Beef Tomahawk Steak,Coles Monterey Jack Cheese Slices
Coles Portobello Brown Mushrooms,Coles Kitchen Superfood Chicken Bowl,John West Rosemary & Sea Salt In Oil Deli Tuna
Kraft Grated Parmesan Cheese Cannister,King Island Dairy Smoked Cheddar Cheese,Divine Classic Cr�me Caramel Dessert 2 pack
The Laughing Cow Light Less Fat Cheese Spread,Coles Dairy Tasty Light Cheese Block,25 Degrees South Victorian Three Cheese Ravioli
Arnott's Cheds Crackers,Coles Deli Express Double Smoked Ham,Coles Lemon Juice
Luv A Duck Frozen Whole Duck,Coles Lamb Whole Lamb Leg Roast,Coles Ultimate Gluten Free Cookies 40% Chocolate Chip
Haagen-Dazs Vanilla Ice Cream Tubs,Magnum Ice Cream Luxe Gold Caramelised Chocolate Tub,Hanabi Frozen Pork Potstickers
Sanitarium Vegie Delights Vegetarian Food Chorizo Vegie Sausages,Coles Barramundi Portions Skin On,Coles Lite Reduced Fat Milk
Nestle Mini Egg Bag,Hot Kid Ball Cakes Honey Flavour,Extra Spearmint Sugar Free Chewing Gum 4x14g
John West Tempters Tuna in Olive Oil,Leggo's Squeezy Tomato Paste Pizza,Cadbury Boost Chocolate Bar
Coles Gluten Free Bagels 4 Pack,Abe's Smoking Gun Rye & Caraway Bagel,Wurstel Chorizo
Aroy-D Coconut Milk,Gaganis Red Beans,Heinz Big Red Tomato Soup Can
Birds Eye Frozen Steam Fresh Plus Pearl CousCous With Chick Peas 2 pack,Inghams Tempura Nuggets,I&J The Finest Frozen Salmon Portions Skin Off
Perfect Italiano Dairy Cheese Extra Sharp Grated Parmesan,Coles Kitchen Loaded Supreme Pizza,Coles Perform Beef Ragu Bolognese
Vege Chips Deli Crisps Original,Port Salut Depuis,Ivans Cottage Pie
Coles Made Easy Chicken Puff Pastry Parcels With Parmesan & Garlic,Coles Sliced Leg Ham,Coles Beef 5 Star Extra Lean Mince
Mersey Valley Club Green Peppercorn Cheese,Kraft Grated Parmesan Cheese Cannister,Coles Bake & Create White Chocolate Block
Coles Free Range Chicken Breast Carved Roast,Ipastai Raviolo Verde Spinach And Ricotta,Haagen Dazs Duo Vanilla Brownie & Raspberry Ice Cream Tub
Well Naturally Peppermint Chip Milk Chocolate Bar No Added Sugar,Sakata Classic BBQ Rice Crackers,Azalea Grapeseed Oil
Coles Smokey Tennessee Style Beef Sausages,Coles Lamb Shanks With Red Wine Sauce Made Easy Slow Cooked,Coles Made Easy Moroccan Lamb Filo Rolls With Fetta & Pumpkin
Coles Finest Thick & Juicy Beef Burger 2 Pack,Primo Beef With Cracked Black Pepper,Coles RSPCA Approved Chicken Thigh Fillets Large Pack
Coles Cheese Shredded Tasty Light,Coles Double Cream,Bulla Aussie Style Yoghurt Vanilla
Casale Parma Matonella,Lee Kum Kee Sweet & Sour Sauce,Moorabool Valley Free Range Eggs 12 Pack
Jarlsberg Swiss Original Wedge Cut,La Casa Del Formaggio Mozzarella Balls,Casale Parma Matonella
Bulla Murray St Hazelnut Fudge 4 Pack,Streets Paddle Pop Rainbow,Oyster Bay Chardonnay 750mL
Dr. Oetker Frozen Ristorante Hawaii Pizza,Coles I'M Free From Beef Sausage Roll,Saltram 1859 Barossa Shiraz 750mL
Republica Organic Capsules Paris,Cadbury Dairy Milk Hazelnut Ice Cream 4 pack,Organic Truss Tomatoes
Skippy Raspberry Cheesecake Protein Bar,Bens Original Long Grain White Rice,Colman's Horseradish Sauce
Ricci's Bikkies Pita Crisp Olive Oil & Sea Salt,Sunbites Grain Waves Sweet Chilli Chips,Pringles BBQ Stacked Potato Chips
Just Juice Apple Juice Multipack 200mL,Golden Circle� Pineapple Juice Fruit Juice,Real Gum Plastic Free Chewing Gum Peppermint
Arnott's Scotch Finger Minis Biscuits 8 pack,Coles Brazil Nuts Natural,French's Classic Yellow Mustard
Coca-Cola Diet Coke Soft Drink Multipack Cans 10 x 375mL,Rapid Loss High Protein Meal Replacement Vanilla,Coles Organic Quinoa Flakes
Coles Bakery Stone Baked Mini Rye Pane Di Casa,Wonder White Bread Gluten Free Wholemeal,Coles Bagels Plain 4 pack
Coles Deli Salad Tubs Medium Quinoa Tabouleh,Coles Iceberg Salad Blend,Coles Dark Chocolate Ginger
Alize Bleu 750mL,Vodka Cruiser Strawberry Soda Spritz Can 275mL,Atkins Endulge Caramel Nougat
Alpine Low Carb,Yoplait Petit Miam Squeezie Fruit Salad Yoghurt Pouch,Coles Bakery Mud Cake
Queen Organic Vanilla Extract,Coles Musk Sticks,San Remo Trivelle Pasta No 17
Coles Kitchen Egg & Bacon Sandwich,Pauls Bluey Chocolate Flavoured Milk,Dairy Farmers Thick & Creamy Strawberry Yoghurt
Coles Sweet Gold Potatoes Loose,Coles Brown Nashi Pears,Jade Phoenix White Backed Black Whole Fungus
Coles Deli Salads Tub Medium Classic Potato,Coles Red Royale Potatoes Loose,Fresh Turmeric
Pasta al Naturale Gluten Free Frozen Potato Gnocchi,Birds Eye Frozen Fish Fillets With Lemon Pepper Crumb Oven Bake 6 pack,Street Calzone Bacon & Egg 4 Pack
Coles Organic Coriander Bunch,Coles Brushed Potatoes,Coles Australian Pecans Nut
Coles Creamy Vanilla Dessert 2 Pack,Nescafe Hazelnut Latte Coffee Sachets,Coles Unsalted Butter
Lindt Bunny Flower Milk,Monster Energy Can Drink Ultra Gold,Edgell Baby Peas & Super Sweet Corn
Coles RSPCA Approved Free Range Chicken Thigh Large Pack,Coles Beechwood Smoked Leg Ham Portion,Ocean King Black Lumpfish Caviar
Coles Pears In Blackcurrant Jelly 4 Pack,Sunbeam Mixed Dried Fruit,Erawan Glutinous Rice Flour
Cobs Cheddar Cheese Gluten Free Popcorn,The Natural Confectionery Co Snakes,Hans Hot Twiggy Sticks
MEB Greek Pita,Coles I'm Free From Blueberry Muffins,Coles Happy Birthday Edible Cake Plaque
Sunny Queen Foodbank Free Range Eggs 12 pack,Coles Cheese Shredded Tasty Light,Coles Kitchen Egg & Mayo Sandwich
Coles Bakery Stone Baked By Laurent Mini Pumpkin & Soybean Pane Di Casa,Abbott's Bakery Gluten Free Mixed Seeds Bread,Coles Country Loaf White
Coles Hot Smoked Salmon Cracked Pepper,British Family Pack Thin Pork Sausages,Coles RSPCA Approved Chicken Necks
Bushells Blue Label Extra Strong Black Tea Bags,Coles Double Chocolate Brownie Mix,Edgell Corn Kernels No Added Salt
Golden Circle Apple Juice,Bare Bones Mushroom Sauce With Truffle,Artisan Sour Red Cherries
Fibre One Chocolate Fudge Brownies 5 pack,Schweppes Raspberry Flavoured Drink,Twinings English Breakfast Decaffeinated Tea Bags
Mission Soft & Fluffy Wrap 12 pack,Coles Bakery Mini Cheese And Bacon Rolls,Coles Happy Birthday Edible Cake Plaque
Coles Half Drumhead Cabbage,Bean Shoots Prepacked,Gourmet Garden Lightly Dried Coriander
Noshu 95% Sugar Free Banana Bread Slices,Coles Turkish Pide,Simson's Pantry Better For You Low Carb Keto Mini's 6 Pack
Weis Mini Mango Fruit Ice Bars 8 pack,Bulla Creamy Classics Cookies & Cream Ice Cream Tub,Twinings Irish Breakfast Tea Bags 100 pack
Coles Marinated Chopped Octopus Pieces,Maggie Beer Pheasant Farm Pate,Coles Minced Garlic
KB's Deli Thawed MSC WA Cooked Rock Lobster,Cleaver's Beef Porterhouse Steak Organic,Coles  Graze Grassfed Beef Fillet Steak
Coles Finest Deli Express Australian Pitted Kalamata With Fennel & Orange,Coles Finest Deli Express Australian Green Manzanillo With Chilli & Garlic,Vegemite Spread
Coles No Added Hormone Beef Brisket Point End Large Piece,Coles Graze Grass Fed No Added Hormone Oyster Blade Thin Sliced Steak,Coles Deli Thawed Australian Cooked Black Tiger Prawns Jumbo
Gullon Sugar Free Shortbread,Coles Musk Sticks,Gaganis Premium Raw Sunflower Kernals
Weis Mini Mango Fruit Ice Bars 8 pack,Pepsi Multipack Cans 375mL,Coles Deli RSPCA Approved Chicken Nibbles Chilli Sriracha
Moondarra Cheese Honey Fig & Macadamia,Coles Vintage Cheese & Crackers 4 Pack,Coles Bakery Rustic Rolls
Coles Deli Fromager D'Affinois Blue Cheese,Honeycomb Berringa Hive & Comb,Sirena Tuna in Oil Italian Style
Edgell Black Beans,Arnotts Vita-Weat Crispbread Pumpkin Seed & Mixed Grain,Red Bull Sugar Free Energy Drink Single Can
Coles Bakery Apple Crumble Log,Coles Finest Macaron Selection,Wonder White Bread Gluten Free
Chobani Fit Strawberry Yoghurt Pot,Five:AM Organic Vanilla Bean Yoghurt,Coles Frozen Strawberries
Coles Mushrooms Dried Mixed Forest,Fresh Red Cayenne Chillies,Coles Pink Lady Apples
Coles Unsalted Butter,Yumi's Gluten Free Classic Smokey Chipotle Hommus Dip,Primo Classic Chorizo 2 Pack
Coles Cranberry Sprinkle,Coles Red Globe Seeded Grapes,Coles BBQ Kri Kri Peanut
Scoop & Weigh Superfood Cocoa Smoothie Powder,Coles Salad Snack Tubs Potato Egg & Bacon,Gordons Gin 700mL
Noshu 97% Sugar Free Iced Funtella Cakes,Coles Vol Au Vent 4 Pack,Primo Traditional Bacon Pieces
Keep It Cleaner Kimchi Slaw,Sheese Tasty Slices,Creative Gourmet Frozen Passionfruit Pulp
Coles Bakery Wholemeal Loaf,Coles Red Velvet Filled Hot Cross Buns,Coles Sugar Donuts
Coles Rump Steak 2 Pack,Steggles Turkey Rissoles,Coles Deli Thawed Cooked Vannamei Prawns
Bulla Crunch Multi Flavoured Ice Cream Sticks 8 pack,Birds Eye Frozen Cauliflower Rice,Avalanche 99% Sugar Free Toffee Drinking Mix
Coles Graze Grass Fed No Added Hormone Oyster Blade Thin Sliced Steak,Drovers Choice No Added Hormone Beef Blade Steak,Coles Honey Belle Pears
Coles Dairy Colby Cheese Slices 12 Pack,Don Crafted Cuts Double Smoked Pansize Bacon,Stonefire Original Naan Bread
KB Lemon & Pepper Squid,Steggles Frozen Flaming Chicken Wing Nibbles,Bulla Choc Fudge Ice Cream 8Pack
Coles Finest Carb Neutral Beef Rump Medallions,Coles Beef Chuck Casserole Steak,Coles Chicken Sage And Thyme Sausages
Cremorne Creamery Peanut Butter Choc,Temptation Frozen Premium Tasty Cheese & Bacon Quiches 2 pack,Red Bull Energy Drink Multipack 473mL
I&J The Finest Frozen Salmon Portions Skin On,Coles Chicken Chippies,Pasta al Naturale Gluten Free Frozen Potato Gnocchi
Arnott's Cheds Crackers,Cottee's Strawberry Jam,Coles Deli Thawed Seafood Highlighter
Jarlsberg Regular Cheese Sliced/Shaved,Coles Mini Croissants,Mountain Dew Caffeinated Citrus
Coles Unsalted Butter,Mainland Extra Tasty Cheese Block,Five:AM Organic Honey & Cinnamon Yoghurt
Coles Dutch Carrots,Coles Bean Shoots Prepacked,Rapaura Springs Pinot Noir 750mL
Coles Dreams Crumb True  Chocolate- Caramel & Fudge Cookies,Coles Butter Pat,Pepperjack Sauvignon Blanc 750mL
Three Aussie Farmers Farmhouse Style Pork Sausages,Inglewood Farms Free Range Organic Chicken Drumsticks,Spring Gully Gherkins Rounds
Gippsland Dairy Strawberry Waffle Mix-Ins,Chobani Greek Yogurt Vanilla,Lemnos Twin Packs Haloumi
Coles Neapolitan Ice Cream Tub,Ben & Jerry's Chocolate Chip Cookie Dough Core Milk Ice Cream Tub,Remedy Kombucha Pink Lady Apple
Coles Finest Persian Fetta,Danone YoPro Pouch Mango,Liddells Strawberry Yoghurt 140 grams
Coles Lamb Rack Roast,Coles Deli RSPCA Approved Chicken Tenderloins Thai,Tassal Salmon Portions Mustard And Dill
Coles I'M Free From Focaccia,Wurstel Chorizo,Don White Hungarian Salami
Don Skinless Thin Frankfurt's,Heinz Big Red Tomato Soup Can,Abbott's Bakery Sourdough English Muffins White
Coles RSPCA Approved Chicken Livers,Coles Smokey Tennessee Style Beef Sausages,Emma & Tom's Karmarama Juice Chilled
Market Lane Smoked Almonds,Simply Wize Gluten Free Crusty Bread,Red Rock Deli Trio Of Cheeses
John West Tempters Tuna Sweet Corn & Mayonnaise,Master Crackles Oven Baked Pork Crackle Sea Salt,Brookvale Union Vodka Lemon Lime Bitters Can 330mL
Jack Daniels & Cola Can 375mL,Pepperjack Sauvignon Blanc 750mL,Marmarabirlik Dried Natural Black Olives
Coles Bakery Sesame French Stick,Lurpak Slightly Salted Butter,Coles Cheese & Chive Dip
Coles White Chocolate & Raspberry Slice 5 Pack,Helga's Corn Tortilla Wrap,Stomping Ground Gipps St Pale Ale Can 355mL
Coles Deli Thawed Raw Peeled Prawn Meat,Future Farm Future Mince,Smirnoff Ice Double Black Guarana Can 250mL
Moccona French Style Smooth & Rounded Instant Coffee,Tom & Luke Snackaballs Salted Caramel Pot,Ben's Original Poke Bowl Rice Pouch Soy & Ginger
Thomson's Deli Middle Bacon,Youfoodz Cranberry Chicken And Potato Bake,Danone Yopro Salted Caramel Flavoured Yoghurt
Coles Beef Eye Fillet Roast,Coles Organic Beef Mince,Coles Deli Salads Tub Large Classic Pasta
Coles Bakery Mixed Biscuit Tray,Coles Bakery Butter Shortbread,Abbott's Bakery Sourdough English Muffins White
Top 20 Variety Potato Chips 20 pack,Cobs Sweet & Salty Gluten Free Popcorn,Jumpy's Chicken 5 pack
Coles Green Chillies,Coles Medium Lemons,Coles Yellow Nectarines
Primo Gourmet World Flavours South African Boerewors,Lilydale Free Range Chicken Tenderloins,Coles Butterflied Pork Shoulder With Lemon & Herb
Mr Donut Iced Chocolate Jam Donuts,Coles Bakery Custard Tarts 6 Pack,Coles Bakery Super Soft Sesame Hot Dog Rolls
Edgell Organic Black Beans NAS,Gravox Roast Pork Pack Liquid Gravy Pouch,Green's Traditional Date Loaf Baking Mix
Coles Vietnamese Mint Punnet,Coles Roasted Salted Cashews,Coles Kitchen Classic Potato Salad
Golden Circle Apple And Raspberry Cordial,Chupa Chups Lollipop,Sunrice Mini Bites Original 8pk
Coles Lamb Shanks With Red Wine Sauce Made Easy Slow Cooked,Coles Lamb Mint & Rosemary Rump Steak,Cleaver's Beef Sausages Paleo Gluten Free Organic
Smirnoff Red Vodka 700mL,Zilzie Bulloak Sauvignon Blanc 750mL,Pure Blonde Bottle 355mL
Bonsoy Almond Milk,Coles Sweetened Condensed Milk,Coles Hot Cross Buns Premium Fruit
Coles Hot Dog Rolls,Helga's Sweet Potato Wrap,Uncle Tobys Plus Iron Cereal
Coles RSPCA Approved Chicken Kebas With Thai Rub,Coles Chicken Filo Rolls Spinach And Cheese,Rocco's Smokey Bacon & Cheese Sausages
Oz Group Australian Frozen Blueberries,Mr Chen's Bbq Pork Dumplings,V Energy Drink Can
Coles Tasmanian Salmon Portions With Lemon & Herb Crumb,Coles Graze Lamb Leg Steak With Thyme And Black Pepper Butter,Coles Deli RSPCA Approved Chicken Breast Satay Style Kebab
Coles Italian Whole Peeled Tomatoes,Ob Finest 3 Cheese Crisps With Chilli,Sanitarium Up&Go Liquid Breakfast Protein Energize Choc Fridge Pack 12X250mL
Coles Deli RSPCA Approved Chicken Thigh Fillets,Coles Organic Beef Scotch Fillet,Coles Crumbed Pork Schnitzel
The Organic Milk Company Salted Butter,Coles Red Royale Washed Potatoes Prepacked,Coles Kitchen Caesar Salad Bowl
Coles Bakery Custard Pull Apart,Coles Bakery High Top Half Toast Loaf,Don Skinless Cocktail Frankfurt's
Coles Sliced Leg Ham,Coles Lamb Leg Butterflied,Coles Made Easy Moroccan Lamb Filo Rolls With Fetta & Pumpkin
Coles No Added Hormone Beef Oyster Blade Steak,Coles Extra Lean Pork Mince,Nestle Pixie Caramel Bar
Coles Cooked Prawns With Cocktail Sauce,Huon Premium Wood Roasted Salmon Portion,Lilydale Free Range Chicken Kebab Katsu Curry
Quorn Frozen Vegan Fillets,Core Powerfoods Beef Tortolleni,Denada Sugar Free Ice Cream Choc Pops Almond Vanilla 3 Pack
Coles Lamb Shoulder Butterflied With Smokey Marinade,Coles Lamb Boneless Leg Roast Small,Coles Hot Smoked Salmon Natural
Coles Choc Chip Banana Bread Slices 5 Pack,Coles Bakery BBQ Cheese And Bacon Mini Pizza Rolls,Mission Soft & Fluffy Wrap 12 pack
Coles Deli Express Garlic Green Olives With Chilli & Garlic,Coles Bakery Mini White Flatbread,Coles Vanilla Mini Cupcakes 9 Pack
Mainland On The Go Tasty Cheese & Crackers 4 Pack,The Cheesecake Shop Citron Cheesecake Cup,Pauls Rev Low Fat Milk Carton
Latina Lasagne with Angus Beef & Vegetables,National Pie Beef Pepper 2 Pack,Hellmann's Real Mayonnaise
Filosophy Mini Spirals Spinach And Feta,McCain Pub Size Chicken & Bacon Bake,Pampas Frozen Lemon Meringue Pies 4 pack
Meet Strips,Coles Frozen Family Beef Pie,Carlton Draught Bottle 375mL
Coles Tasmanian Salmon Portions With Lemon & Herb Crumb,Coles No Added Hormone Beef Sandwich Steak,Coles Lamb Cutlets
McCain Red Box Plated Veal Cordon Bleu,Quest Chocolate Chip Cookie Dough Protein Bar,Napolina Plum Tomatoes
Sabrini Punjabi Asli Samosa,McCain Frozen Sweet Potato Chips,Coles Bakery Croissants 3 Pack
Coles Green Cucumber,Coles Kitchen Superfood Slaw Mix,Coles Deli Salads Tub Jumbo Classic Pasta
Top 20 Variety Potato Chips 20 pack,Coles Snackers Delight Platter,Coles Deli Express Primo Speck
Coles Vietnamese Mint Punnet,Coles Organic Garlic Prepacked,Coles Kitchen Asian Teriyaki Stir Fry
Charlotte'S Bakery Slow Cooked Beef Shiraz & Onion Pies 2 Pack,Lean Cuisine Spaghetti Bolognese,Nexba Classic No Sugar Tonic Water
Coles Organic Sweet Potatoes Prepacked,Coles Organic Snacking Tomatoes,Coles Yellow Papaw
Annabel Karmel Meals Cottage Pie,Annabel Karmel Fish Pie,Kb's Whiting Bites Battered
Harvest Snap Original Pea Salted Multipack 5X18g,Coles Crumb & Cook Coconut & Kaffir Lime,Milka Hazelnut Milk Chocolate
Vetta Smart Protein Penne Pasta,Nice & Natural Trail Mix Nut Bars,Bega Strong & Bitey Vintage Cheese Block 24x250g
K-Roo Kangaroo Steak,Coles Beechwood Smoked Boneless Leg Ham Portion,Edgell Sliced Beetroot
Coles Herb Punnets Curry Leaves,Coles Cranberries,Coles Lychees Prepack
I&J Salt & Pepper Squid Stick,Birds Eye Oven Bake Snapper,Tassal Salmon Portions Skin On
Nutrisoy Organic Tasty Tempeh,Keep It Cleaner Kimchi Slaw,Primo Stacker Chicken Cheese & Rice Crackers
Dairy Farmers Thick & Creamy Yoghurt Vanilla,Coles Ice Cream 5pk Mini Vienna Mint Sticks,Coles Longans
Cleaver's Beef Stir Fry Free Range Organic,Coles Finest Carbon Neutral Beef Porterhouse Steak,Tassal Salmon Portions Mustard And Dill
V2 Schnitzel Original Plant Based 2 Pack,Coles Deli RSPCA Approved Chicken Breast Kebab Honey Soy,Red Rock Deli Lime & Pepper Potato Chips
Coles Australian Made Coppa Ham,Maggi Veg Sensations Three Cheese Potato Bake,Pringles Cheese Potato Chips
Coles Quick Cook Pork Belly Slices,Coles Beef Tender Blade Roast,Drovers Beef Ribs
Coles Finest Gorgonzola Dolce Dop,Arnott's Tim Tam Double Coat Chocolate Biscuits,Galliano Black Sambuca 500mL
Sensi Prosecco DOC 18K Gold 750mL,Cleanskin Vodka 700mL,Coles Frozen Whole Baby Beans
Coles Vegan Mushroom And Lentil Pies 2 pack,Super Nature Super Pulses Wholemeal Beef Lasagne With Black Lentils,Nanna's Frozen Apple Pie
Coles Cheddar Snack Pack,Uncle Toby's Roll Ups Berry Sour,Cadbury Creme Eggs Minis Easter Bag
Birds Eye Frozen Deli Barramundi Crisp Light Batter 5 pack,Birds Eye Frozen Steam Fresh Beans Carrot & Broccoli Mix 3 pack,Sunraysia Cranberry Juice Bottle
Oreo Creme Biscuits Original,Musashi Protein Crisp Bar Dark Choc Mint,Don Pariser
Mingle Garlic and Herb Seasoning,Coles Lamb Shoulder Roast On The Bone,Jameson Raw and Cola Can 375mL
Tassal Salmon Portions Skin On,Tassal Tasmanian Smoked Salmon Premium Selection,V2 Sausage Garlic & Herb Plant Based
Primo Beef With Cracked Black Pepper,Coles RSPCA Approved Chicken Drumsticks With Mediterranean Glaze,V2 Popcorn Bites Southern Style Plant Based
Lipton Ice Drink Tea Lemon No Sugar,Continental Cup A Soup Creamy Pumpkin With Croutons Serves 2,San Remo Linguine Pasta No 1
Yumi's Classic Hommus With Pesto Rocket And Almond,Black Swan Hommus Dip,Hans Leg Ham & Tomato Chutney Lunch Plate
Connoisseur Rocky Road 4 Pack,Coles Frozen Chocolate Lava Cake 2 pack,Birds Eye Sweet Corn Veggie Bites
Something To Crow About Crispy Coated Nuts Maple Walnut,Cadbury Pascall Chocolate Eclairs Lollies,Coles Organic Soy Milk
Mr Kipling Lemon Bakewell,Sonoma Baking Indulgent Fruit And Spice Hot Cross Buns 4 pack,Simson's Pantry Preservative Free Mixed Wholegrain Large Wraps 8 Pack
Sunfed Boar Free Bacon Premium Hickory,Coles Graze Lamb Leg Steak With Thyme And Black Pepper Butter,Herb & Sons Chicken-Free Nuggets
Quaranta Soft Nougat Cakes French Caramel,Oreo Creme Biscuits Double Stuff,Coles Finest French 18 Month Aged Comte
Sanitarium So Good Almond Barista Uht Milk,Chatime Peach Iced Bubble Tea,Coles Double Cream Camembert
Copha Vegetable Cooking Oil Solid,Oak Vanilla Malt Flavoured Milk,Primo Cafe Classics Sliced Chicken Schnitzel
Coles Urban Coffee Culture Dolce Gusto Hot Chocolate Capsules,Cremorne Creamery Cookies & Cream,Coles Frozen Baby Peas
La Casa Del Formaggio Reduced Fat Ricotta,Zafarelli Lisio Piccolo Pasta No 40,Cadbury Twirl Chocolate Multipack 12 Treats
Coles Citrus Fruit And Nut,Coles Hazelnut And Cranberry Coco Granola,Coles Deli Salads Tub Large Classic Coleslaw
Primo Manuka Honey Leg Ham,Thomson's Deli Sliced Turkey,Birds Eye Frozen Fish Fillets With Herb & Garlic Crumb Oven Bake 6 pack
