product,alt1,alt2
Brewmanity Slider Cold XPA Can 375mL,Wolf Of The Willows PUP Can 355mL,Good Tides Hard Seltzer Raspberry Vodka 330mL
Three Aussie Farmers Louisiana Pork Sausage,Coles Beechwood Smoked Pork Speck Portion Boneless,Coles RSPCA Approved Garlic And Herb Chicken Schnitzel
Pensilva Pinot Noir 750mL,Malfy Gin Con Arancia 700mL,Pure Blonde Can 375mL
Noshu 95% Sugar Free Birthday Cake Donut,Coles Bakery Custard Pull Apart,Genius Glg GLG Tiger Bloomer Loaf
Coles Wombok Chinese Cabbage Whole,Coles Radish Bunch,Coles Red Tipped Eco Bananas
Coles Finest Aged Red Leicester,Red Storm Vintage Red Leicester Cheddar,Lucky Chicken Free Range Eggs 12 pack
Coles Tomato Salsa Mild,MasterFoods Tomato Sauce,Coles White Plain Flour
Coles Pink Lady Apples 1kg,Coles Longans,Coles Honey Roasted Mixed Nuts
Birds Eye Frozen Fish Fillets With Original  Crumb Oven Bake 6 pack,Birds Eye Frozen SteamFresh Broccoli Cauliflower & Carrots With Cheese Sauce 2 Pack,Creative Gourmet Frozen Mixed Berries
The Still Co. Blue Butterfly Gin 500mL,Colonial IPA Can 375mL,Wild Turkey & Cola 101 Can 375mL
Dulong Reserve Saint Emilion 750mL,Bumblebee Organic Cabernet Sauvignon 750mL,Sapporo Can 500mL
Arnott's Nacho Cheese Shapes,Mission Original White Corn Tortilla Strips,Slim Secrets Choc Love Bites Salted Caramel
Sara Lee Cookie Pies Dble Choc & Slt Cara 4pk,Coles Frozen Chocolate Tart,On The Menu Beef Rissoles Plated Meals
Coles Trimmed Celery Prepacked,Coles Brushed Potatoes,Coles Organic Garlic Prepacked
Jameson Soda Ginger Lime 4.8% Can 375mL,Moon Dog Old Mate Pale Ale Can 330mL,Mayfair Rhubarb & Ginger Gin 700mL
Hop Nation The Heart Pale Ale Can 375mL,Tinnies Stout Can 375mL,Smirnoff Ice Double Black Zero Can 375mL
Tassal Tasmanian Smoked Salmon Premium Selection,Coles Pork Sizzle Steaks,Ballewindi Pinot Noir 750mL
Coles No Added Hormone Beef Brisket Slow Cook,Coles Beef Chuck Casserole Steak,Lilydale Butterflied Boneless Chicken Jamacian Jerk
Primo Thin Frankfurt,Tip Top Burger Thins,Coles Unicorn Acrylic Plaque
Hahn Super Dry Can 375mL,Billson's Passionfruit Vodka Mixed Drink Can 355mL,Vodka Cruiser Sour Grape 275mL
Squealing Pig Pinot Gris 750mL,Great Northern Super Crisp Lager Block Can 375mL,Fitness Outcomes Beef Rendang & Brown Rice
Coles Ginger loose,Coles Coconut Chunks,Coles Brushed Baby Potato
Sailor Jerry Spiced Rum 1L,El Sueno Tequila Gold Bottle 700mL,Brown Brothers Sparkling Moscato 750mL
Primo Short Cut Bacon,Coles RSPCA Approved Chicken Thigh Fillets Small Pack,MEB Pita Family White 5 pack
Pacific West Japanese Gyoza,Dr. Oetker Frozen Ristorante Spinaci (Spinach) Pizza,Streets Blue Ribbon Duos Caramel Hokey Pokey
Chacha Roasted Sunflower Seeds Spiced,Jila Sugar Free Spearmint Mints,Coles Bake & Create Mini Polka Dot Patty Pans
Coles RSPCA Approved Chicken V Wings,Coles Deli Thawed Cooked Vannamei Prawns,Coles No Added Hormone Beef Marrow Bones
Coles Asian Choy Pak,Coles Organic Baby Cos Lettuce,Coles Cauliflower Medium
Little Creatures Pacific Ale Can 375mL,Strongbow Ultra Mango Can 330mL,Ketel One Vodka 700mL
Coles RSPCA Approved Chicken Tenderloins,Ocean Blue Sliced Smoked Salmon,Ben's Original Taste Of Takeaway Korean BBQ Rice Pouch
Cadbury Raspberry Mini Rolls 5 pack,Mr Donut Chocolate Jam Ball Donuts,Provedore Pancetta Crumb
Aeroplane Orange Orbit Jelly Crystals,Coles Premium Pineapple Pieces,Pran Wonder Kids Halal Boys & Girls Chocolate
Coles RSPCA Approved Chicken Kebabs With Sticky BBQ Rub,K-Roo Kangaroo Burgers,Lee Kum Kee Soy Sauce
Frys Meat Free Chicken Stars & Moons,I&J Raw Prawns Tail On,Bundaberg UP Rum 700mL
Zilzie Liv Lighter Sauvignon Blanc 750mL,Tar & Roses Sangiovese 750mL,Penfolds Father 10YO Tawny NV 750mL
Gordons Tropical Passionfruit Bottle 330mL,Wolf Blass Red Label Cabernet Merlot 750mL,23rd Street Signature Gin 700mL
Native Spirits McLaren Vale Modern Gin By Never Never 500mL,Fixation Little Ray IPA Can 375mL,Well Naturally No Added Sugar Milk Chocolate Salted Caramel
Coles Kitchen Thousand Island Salad Kit,Coles Kitchen Broccoslaw,Coles Jumbo Value Pack Baby Spinach
Bells Blended Scotch Whisky 700mL,Great Northern Zero Bottle 330mL,John West Protein+ Bowl Corn Chilli RKB
Coles Pomelo,Coles Organic Green Beans Prepacked,Market Lane Honey Macadamias
Brewmanity Slider Cold XPA Can 375mL,White Claw Hard Seltzer Natural Lime 330mL,Amore Bello Vermentino 750mL
Coles Kitchen Vegetables Baby Potatoes Herb Butter,Coles Portobello Mushrooms,Coles Graze Grassfed Beef Scotch Fillet Steak
Coles Premium Strawberries,Coles Black Plums,Coles Organic Green Kale
Penfolds Koonunga Hill Shiraz Cabernet 750mL,The Kraken Spiced Rum 1L,Vodka Cruiser Mixed 275mL
Plantry Frozen Plant Based Meal Lasagna,Birds Eye Frozen Fish Fillets With Original Crumb Oven Bake 14 Pieces,Avalanche 99% Sugar Free Toffee Drinking Mix
Poulings Sliced Pork,Coles BBQ Meatlovers Pizza,McCain Red Box Tray Fettucine Carbonara
42 Degrees South Pinot Noir 750mL,De Bortoli Cartolina Prosecco 750mL,Jack Daniels Gentleman Jack Tennessee Whiskey 700mL
Sanitarium So Good Unsweetened Almond Milk,Easiyo Greek Style Coconut Yoghurt,Health Lab Uh Oh Cookie Dough Raw Dessert Ball 4 pack
Coles Apple & Cinnamon Muffins,Coles Brioche Rolls 8 Pack,We Love Cake Vegan Caramel Slice 4 Pack
Maharajah's Choice Calico Basmati Rice,Coles Pasta Penne,Star Foods Rolada Fig Walnut
Pepperjack Sangiovese 750mL,Far & Wide Chardonnay 750mL,Billson's Tropical Punch Vodka Mixed Drink Can 355mL
Coles Okra loose,Coles Organic Spring Onions,Coles Radish Bunch
Colonial IPA Can 375mL,4 Pines Brewing Hazy Pale Ale Can 375mL,Moon Dog Tinnies Yuzu Can 330mL
Coles Yoghurt Cranberry,Coles Organic White Seedless Grapes,Coles Keitt Mangoes
Coles Bakery Stone Baked By Laurent Turkish Loaf,Coles Gluten Free Chocolate Hot Cross Buns,Noshu 96% Sugar Free Angel Cake Slices
Coles Spinach And Butter Leaf,Coles Coles Spudlite Baby Potato,Fresh Turmeric
Coles Pitted Medjool Date,Coles Medium Lemons 5 Pack,Sanitarium Up&Go Protein Energize Liquid Breakfast Vanilla 12X250mL
Coles Kitchen Hoisin Pork Springroll,Youfoodz Clean Chicken With Sweet Potato & Broccoli,La Famiglia Pane Di Casa Just For 2
Coles Deli Express Kabana,Coles Marinara Seafood Mix,Artisan Whole Dried Cranberries
Four Pillars Bloody Shiraz Gin & Tonic Can 250mL,Billson's Passionfruit Vodka Mixed Drink Can 355mL,MasterFoods Honey Mustard Chicken Recipe Base
Sara Lee Dluxe Semifredo Chocolate & Slt Caramel,Connoisseur Vanilla Ice Cream 4 Pack,Coles Creamy Choc Dessert 2 Pack
Barilla Basilico Pasta Sauce,Campbell's Country Ladle Soup Can Hearty Beef & Vegetable,Always Fresh Stuffed Olives Pimento
Coles Special Burger Sauce,Heinz Classic Creamy Pumpkin Soup Can,Queen Designer Icing White
Wolf Blass Red Label Cabernet Merlot 750mL,Wynns Reframed Cabernet Sauvignon Cabernet Franc 750mL,Winesmiths Premium Selection Shiraz Cask 2 Litre
Coles Portobello Brown Mushrooms,Golden Circle Beetroot Slices,Whispers Chardonnay 750mL
Coles Hass Avocados,Coles Sugar Snap Peas Loose,Coles Coconut Whole
Sunraysia Pouch 99.9% Apple & Blackcurrent Juice,Balter XPA Can 375mL,Coles Penne Napoletana Pasta
Coles Brown Mushrooms Loose,Coles Cauliflower Medium,Coles Creme Royale Brushed Potatoes loose
Labyrinth Pinot Noir 750mL,Tussock Jumper Pinot Grigio 750mL,Yellowglen NV Red 750mL
Coles Mini Tart Selection 6 Pack,Coles Bakery Stone Baked Mini Rye Pane Di Casa,Simson's Pantry Low Carb High Protein + Fibre 6 pack
Carman's Iced Coffee Protein Bars 5 Pack,Happy Snack Company Favva Beans Sea Salt & Vinegar 6 Pack,Easiyo Greek Style Passionfruit Yogurt
Primo Hot Hungarian Salami,Bertocchi Authentic Boneless Leg Ham,Jarlsberg Swiss Original Wedge Cut
Cadbury Dairy Milk Mousse 2x80g,Nestle Chokito Block Chocolate,Penfolds Max'S Shiraz 750mL
Twin Elephants Green Jackfruit,Deliciou Everything Seasoning,MasterFoods Ground Ginger
Riverina Dairy Haloumi Basil,Coles Dairy Avocado Dip,Ray's Traditional Home Style Plum Pudding No 4
Jack Daniels American Serve & Cola 250mL,Wild Turkey Rare & Cola Bottle 320mL,Brewmanity Slider Cold XPA Can 375mL
Coles Vanilla Mini Cupcakes 9 Pack,Coles Happy Birthday Acrylic Plaque Gold & Silver Small,Coles Low Fat Creamed Cottage Cheese
Alpine Wholemeal Lower Carb,Orgran Buckwheat Pancake Mix,Parker's Baked Pretzels Wheat Original
Chobani Flip Mint Chocolate Chip Yoghurt,Danone Yopro Perform Yoghurt Mixed Berries,Queen Celebrating 120 Years Master Blend Pure Vanilla Extract
Coles Italian Style Salami,Thomson's Deli Supreme Chicken Breast,Natural  Wafer Crackers
Black Swan Crafted Spinach And Feta Dip,Coles Finest Spanish 12 Month Aged Manchego,Guzzi's Linguine Pasta
Oban 14YO Single Malt Scotch Whisky 700mL,Deeds Juice Train NEIPA Can 375mL,Somersby Pear Cider Can 375mL
Midori Illusion Bottle 275mL,Belena Moscato 750mL,Woodstock Bourbon & Cola 6% 375mL
Helga's Prebiotic Ancient Grains Seed Loaf,Noshu 95% Sugar Free Caramel Spice Donut,Don Pepperoni Salami
Coles Melon Honeydew Yellow Half,Coles Baby Leaf Salad & Beetroot,Gourmet Garden Lightly Dried Coriander
On The Menu Frozen Chicken Roll Roast,Birds Eye Plant Based Chicken Burgers,Coles Vegan Mushroom And Lentil Pies 2 pack
Kirks Creaming Soda Soft Drink Bottle,Allen's Strawberries & Cream,Frys Meat Free Popcorn Chicken
Cornwell's Lancashire Relish,Kan Tong Thai Red Curry Paste Jar,Schweppes Dry Ginger Ale Classic Mixers Multipack Bottles 300mL
Yoplait Petit Miam Mango Yoghurt Pouch,Dream Whip Whipped Dairy Topping Cream,Jarlsberg Original Cheese Block
Sanitarium Vegie Delights Vegetarian Food Chicken Style Sausages,Veef Plant Based Butter Chicken,Gippsland Dairy Choc Fudge Honeycomb Mix-Ins
Tangled Vine Cabernet Merlot Cask 4 Litre,Oyster Bay Rose 750mL,Smirnoff Ice Double Black Guarana Can 250mL
Coles Free Range Pork Fillet,Coles Beef Roast & Onion Garlic & Red Wine Rub,Coles Roasted Salted Mixed Nuts
Coles Chocolate Almonds,Coles Brown Mushrooms Prepacked,Coles Wombok Chinese Cabbage Wombok Petite
Coles Chocolate Bavarian,Gelatissimo Gelato Italian Hazelnut,McCain Pub Size Loaded Parma BBQ Meatlovers
Mr Chen's Bao Buns,KB Salt & Pepper Prawns,Shine+ Ginger Lemon Shot Smart Drink
Vitality Ryegrid Sourdough,Coles Gluten Free Premium White Loaf,Tip Top White Hamburger Rolls
K-Roo Kangaroo Mince,Coles Beef Eye Fillet Steak,Coles Crumbed Fish Bites Salt & Pepper
Canard Duchene Brut NV Champagne 750mL,The Macallan 12YO Double Cask Single Malt Whisky 700mL,De Bortoli Rose Rose 750mL
Coles Sleeved Herbs Parsley Continental,Coles Salad Family Baby Spinach,Don Deli Leg Ham
Coles Cherry Tomatoes Prepacked,Coles Fresh Chillies Mixed,Coles Natural Macadamias
Olga's Fine Foods Chicken Patties,Coles Free Range Pork Loin Medallions,Tassal Salmon Portions Mustard And Dill
Coles Thin BBQ Pork Sausages,Coles Finest Hot & Spicy Beef Burgers 2 Pack,Coles Finest Thick & Juicy Beef Burger 2 Pack
Coles Green Chillies,Coles Herb Thai Basil Punnet,Coles Brushed Baby Potato
Terrys Milk Chocolate Orange Gift Box,Coles Strawberry Fruit Puree Blend Pouch,Coles Perform Chocolate Whey Protein Powder
Coles Organic Quick Oats,Vege Chips Mini Rice Crackers Multi 12 Pack,Red Island Extra Virgin Olive Oil
Coles Deli Express Chicken Pate,Coles Pancetta,Coles Pasta Penne
Oob Organic Frozen Strawberries,Mars Chocolate Smooth Creamy Ice Bar 6 Pack,Charlotte'S Bakery Slow Cooked Beef Shiraz & Onion Pies 2 Pack
Coles Lamb Diced,Coles Beef Eye Fillet Roast,V2 Mince Plant Based
Perfect Italiano Dairy Cheese Grated Mozzarella:Mozzarella,Chobani Fit Strawberry Yoghurt Pouch,Arnott's Milk Coffee Biscuits
King Of Kings Peking Duck Pastry,Core Powerfoods Beef Taco Bowl,Streets Golden Gaytime Violet Crumble 4 Pack
Coles I'M Perfect Lemons Prepacked,Coles Vitality,Coles Kitchen Cauliflower Rice
Leggo's Creamy Sundried Tomato & Garlic Pasta Bake Sauce,San Remo Pasta Cannelloni,Schweppes Lemonade Soft Drink 24x375mL
Coles Veal Fillet Whole,Coles Lamb Leg Steak With Middle Eastern Rub 2 Pack,Coles Natural Spring Water
Coles Baby Carisma Potatoes,Coles Birdseye Chillies,Yebisu Premium Can 350mL
Cadbury Dairy Milk Mousse 2x80g,Jarlsberg Dairy Original Swiss Cheese Slices,Ashgrove Signature Red Leicester
Jarrah French Vanilla Latte Instant Coffee,Belvita Cranberry & Sultana Soft Bakes Biscuit,Lemnos Twin Packs Haloumi
Mr Donut Assorted Donuts,Coles No Added Sugar Dark Chocolate With Peppermint,Crosse & Blackwell Branston Pickles
Abbott's Bakery Light Rye Bread,Tip Top Original Thins Sandwich,Kiri Cheese Cream
Coles Bake At Home White Dinner Rolls,Coles Cheese Rolls,Coles Bakery Apple Crumble Log
Bega Tasty Block,Sweet William Dairy Free Vegan Mylk Chocolate Block,Extra Pineapple & Coconut Sugar Free Chewing Gum
Remedy Sodaly Orange Can,Golden Circle� 50% Less Sugar Pear Pineapple And Passionfruit Fruit Juices,Sabrini Onion Bhaji
Coles Deli Thawed Australian Cooked Black Tiger Prawns Jumbo,Lilydale Free Range Chicken Stir Fry Large Pack,Coles Made Easy Slow Cooked Pork Riblets With Smokey BBQ Glaze
Coles Crumbed Fish Fingers 16 Pack,Coles Mozzarella Cheese Bites,Coles Lettuce Decorative Oak Red
Sabrini Aloo Tiki,KB Frozen Prawn Gyoza,Brown Brothers Prosecco NV 750mL
Carman's Salted Caramel Nut Butter Gourmet Protein Bars 5 pack,Sanitarium Up&Go Liquid Breakfast Choc Ice Cereal No Added Sugar 3X250mL,Just Pink Gin Soda 330mL
Farmers Union Greek Style Yoghurt,Made By Cow Cold Pressed Raw Milk,Coles Kitchen Double Pepperoni Pizza
Liddells Colby Cheese Slices,A2 Full Cream UHT Milk,Coles Kitchen Ham & Cheese Croissant
Arnott's Cheds Crackers,Coles Deli Delre Goat Milk Caprakaas,Coles Pesto Basil
Mission Extreme Cheese Tortilla Triangles Corn Chips,Mission Street Tacos,Tandaco Southern Fried Chicken Coating Mix
Ben & Jerry's Chocolate Chip Cookie Dough Core Milk Ice Cream Tub,Coles Ice Cream Mini Vienna Salted Caramel Sticks 5 Pack,Coles Perform Portuguese Style Chicken
Perfect Italiano Original Ricotta Soft Cheese,King Island Dairy Phoques Cove Camembert Cheese,Latina Dy Pasta Sauce Italian Tomato Garlic
Wicked Sister Caramel Crunch Sundae,Golden Circle� Pineapple Juice Fruit Juice,Shaerge Peanuts Salt
Agrios Wild Alaskan Red Sockeye Salmon Portions Skin On,Coles Slow Cooked Pulled Pork,Farms Beef Mince Family Pack
Protea Foods Lekker Peri Peri Biltong Stokkies,Coles Hot Dog Rolls,White Wings Self Raising Flour
Ben's Original Sriracha Rice Pouch,Trident Thai Chicken Noodle Soup,Santa Vittoria Azurra Frizzante Sparkling Mineral Water
Coles Gluten Free Wholemeal Loaf,Coles Finest By Laurent Rye Sourdough Vienna,Coles Deli Express Guzzardi Semi Dried Tomatoes With Fresh Basil
Arnott's Monte Carlo Biscuits,Eclipse Peppermint Sugar Free Mints Tin,Coles Deli RSPCA Approved Chicken Cordon Bleu
Veef Plant Based Premium Chicken Burger,Bulla Sour Cream,Somersby Super Crisp Apple Cider Bottle 330ml
Coles Deli Fresh Salmon Fins,Fremantle Marinated Octopus Original,Tibaldi Authentic Ham Off The Bone
Coles No Added Hormone Beef Quick Cook Porterhouse  Steak,Lilydale Free Range Chicken Breast Fillets Bulk Pack,Coles RSPCA Approved Chicken Kebabs Honey & Soy
Mr Kipling Chocolate Slices 6 Pack,Coles Bakery Jumbo Cookie White Choc & Macadamia,Simson's Pantry Garlic Naan Bread
Coles Canola Oil Cooking Spray,Hoyts Bouquet Garni 4 Sachets,Thins Original Potato Chips
Saunders Malt Extract,Coles Lactose Free Full Cream Milk,Coles Kitchen Pulled Pork Mac N Cheese
Rocco's Smokey Bacon & Cheese Sausages,Coles Lamb Leg Roast Half,KB's Deli Thawed MSC WA Cooked Rock Lobster
Tic Tac Peppermint Mints,Mother Passionfruit 4X500mL,Coles Mexican Sauce
Coles Light Sour Cream,Rokeby Farms Probiotic Filmjolk Natural Yoghurt,Royal International Prosciutto Di Parma 16month
La Espanola Extra Virgin Olive Oil,Coles White Plain Flour,Pringles Original Salted Stacked Potato Chips
B Francois Brut NV 750mL,Jamiesons Run Grazier Sem Sauv Blanc 750mL,Steggles Salt & Vinegar Chicken Fingers
Coles Green Asparagus,Coles Kitchen Classics Mixed Leaf Garden Salad,Coles White Nectarines Prepacked
Nestle Bakers' Choice White Chocolate Melts,Nescafe Gold Short Black Strong Instant Coffee,Coles Organic Coconut Milk
Menz Jelichocs Choccy Milk Bottles,Golden Circle Pear Apple & Raspberry Juice No Added Sugar Fruit Juices,Flying Goose Sriracha Mayo
Danone Yopro Perform Plain Yoghurt,Coles Greek Style Yoghurt,Mil Lel Extra Sharp Parmesan
Connoisseur Ice Cream  Butterscotch & Gingerbread,Creative Gourmet Frozen Organic Acai Puree,Coles Lamb Rump Roast
Coles RSPCA Approved Chicken & Cheese Burgers,Coles Organic Beef Porterhouse Steak,Coles Carb Neutral Beef Rib Eye Roast
Coles RSPCA Approved Free Range Chicken Lovely Legs,Coles Lamb Cutlets,Drovers Choice Beef Eye Fillet Piece
Mission Spinach & Herb Wraps 8 pack,Coles Pikelets 8 pack,Coles Bakery Iced Cupcakes
Kettle Sea Salt & Vinegar Potato Chips,Smith's Crinkle Original Potato Chips,Doritos Corn Chips Nacho Cheese Share Pack
Coles Urban Coffee Culture Hazelnut Syrup,MasterFoods Australian Mustard,Carman's Low Sugar Low Carb Bars Cookie Crunch
Coles Vanilla Mini Cupcakes 9 Pack,Coles Hot Cross Buns Premium Fruit,Bertocchi Soppressa Extra Hot Chilli
Coles No Added Hormone Beef Tomahawk Steak,Inglewood Organic Chicken Strips Plain,Tassal Tasmanian Smoked Salmon Premium Selection
Oreo Sharepack Mini Biscuits Chocolate,Happy Snack Company Dark Choc & Raspberry Roasted Chickpeas 5 pack,Moro Red Wine Vinegar
MEB Pita Khobz Wholemeal 5 pack,Coles Gluten Free Bagels 4 Pack,Coles Bakery BBQ Cheese And Bacon Mini Pizza Rolls
Rokeby Farms Probiotic Filmjolk Natural Yoghurt,Coles Iced Donuts,Provedore Italian Style Charcuterie
Dairy Farmers Buttermilk,Dodoni Elco Feta Cheese,Dineamic Chicken Fajita Rice & Veg
Coles Vegan Mushroom And Lentil Pies 2 pack,Pattu Sona Masoori Rice,Aeroplane Raspberry Jelly Crystals
Coles Bakery Sponge Roll Mini Choc,Alpine Protein Bread,Helga's Gluten Free Traditional Wholemeal Bread
Queen Blue Food Colour,Beerenberg Dressing Ranch,Coles Jumbo Value Pack Baby Spinach
Kraft Mac And Cheese Three Cheese Pasta Macaroni Noodles,Nongshim Seafood & Mild Neoguri Ramyun Noodle,Darrell Lea Milk Chocolate Raspberry Rocklea Road Block
Coles Pineapple Tops On,Coles Organic Red Seedless Grapes,Coles Poblano Green Chillies loose
Coles RSPCA Approved Chicken Kebas With Thai Rub,Coles Deli RSPCA Approved Chicken Drumsticks,Coles Lamb Rump Roast
Coles Marinated Danish Fetta,Pauls Simply Fresh Stroganoff Lite Sour Cream Meal Base Sauce,Pauls Rev Low Fat Milk Carton
Philadelphia Soft Cream Cheese Tub,Coles Dairy Olive Oil Spread,Glen Scotia Harbour Single Malt Scotch Whisky 700mL
Coles Prunes,Coles Snacking Carrots,Coles Deli Salad Large Tubs Potato Egg & Bacon
Maggi 2 Minute Chicken Flavour Noodles 5 Pack,Nestle Whole Grain Energy & Fibre Milo Cereal Family Pack,Arnott's Lemon Crisp Biscuits
Coles Kitchen Kaleslaw Kit,Coles Kitchen Thousand Island Salad Kit,Coles Deli Salad Tubs Large Quinoa Tabouleh
Real Tasty Cheese Hungarian Salami & Rice Crackers 3 Pack,Coles RSPCA Approved Chicken Breast Steaks Lemon & Herb,Oban 14YO Single Malt Scotch Whisky 700mL
Selva Vermicelli Pasta,Jack Link's Teriyaki Beef Jerky,Orchy Orange & Passionfruit Juice Chilled
The Natural Confectionery Co Snakes,Smith's Crinkle Cut Original Chips 6 pack,La Casa Del Formaggio Mozzarella Balls
Coles Brown Sugar,Kez's Kitchen Choc Crunch Protein Fruit Bars,Patak's Ready To Eat Plain Pappadums 6 Pieces
Steggles Frozen Crumbed Chicken Breast Fingers,Dr Oetker Ristorante Vegetale Pizza,Rockstar Punched Tropical Guava Flavoured Energy Drink 500mL
Coles Smooth Ricotta,Coles Dairy Tasty Light Cheese Block,Oak Thickshake Neapolitan Flavoured Milk
John West Smoked Tuna Slices,Heinz Canned Baked Beans English Recipe,Laucke White Crusty Calico Bag Bread Mix
Coles Hot Cross Buns Special Burger Sauce,Coles Bakery Custard Tarts 6 Pack,Coles Bakery Dark Fruit Cake
Simson's Pantry Low Carb Mini 6 pack,McCain Pub Size Double Meat Bacon Carbonara,Coles Dreams Crumb True Red Velvet Cookies
K-Roo Gourmet Kangaroo Meatballs,Coles Graze Grassfed Beef Diced Steak,Primo Gourmet Caramelised Onion Pork Sausage
Maggie Beer Duck & Orange Pate,Coles Finest Dutch Palmiers With Smokey Spicy Paprika,Cadbury Turkish Delight Chocolate Bar
Yopokki Sweet & Spicy Rapokki,Lean Cuisine Veg'D Up Beef Lasagne,Nutella Hazelnut Chocolate Spread
Red Tractor Organic Steel Cut Oats,Coles Whole Black Peppercorn Refill Bag,Edgell Peas & Carrots
Coles Honey Cashews,Coles Fresh Turnips,Coles Organic Brushed Potatoes Prepacked
Coles Canola Oil Cooking Spray,Nestle KitKat Milk Chocolate Block,Coles Snackers Delight Platter
Rokeby Farms Smoothie Dutch Chocolate,Activia Low Fat Field Berries Yoghurt 4x125g,Coles English Muffins 6 Pack
Coles Bakery Croissants 3 Pack,Cucina Matese Gluten Free Spaghetti Pasta,Coles Chef Blend Tender Leaf Blend
John West Protein+ Bowl Risoni Corn- Caps Lem,Coles Bake At Home White Dinner Rolls,Just Juice Orange Juice Multipack 200mL
Coles Butter,Mersey Valley Original Spreadable Cheddar Cheese,Coles Full Cream Milk
Coles Bakery Low Gi 7 Seeds & Grains Vienna Bread Loaf,Coles Salted Caramel Profiteroles,Coles Meringue Nests 8 pack
Lindt Milk Mini Eggs,Barilla Mulino Bianco Pan Di Stelle Chocolate Biscuit Cookie,Heinz Baked Beans In Tomato Sauce 4 pack
Coles Deli Seafood Salad,Coles Finest Meatballs,Coles Graze Grass Fed No Added Hormone Oyster Blade Thin Sliced Steak
Simson's Pantry Low Carb Keto 5 pack,Alpine Spelt & Barley,We Love Cake Salted Caramel & Chocolate Tarts
Coles White Nectarines Prepacked,Coles Pink Lady Apples,Coles Kitchen Classic Pasta Salad
Coles Cranberries,Coles Papaya Loose,Coles Kitchen Sour Cream Sweet Chilli Salad Kit
Moccona Classic Dark Roast Instant Coffee,T2 Wakey Wakey,Diet Rite Apple Blackcurrant Cordial
Nexba Non Alcoholic Spritz Limoncello,Absolut Vodka 700mL,Fitness Outcomes Frozen Sriracha Free Range Chicken With Basmati Rice & Broccoli
Coles Bakery Fresh Cream Chocolate Eclairs,Coles Bakery Dark Fruit Cake,Azalea Grapeseed Oil
Queen Finest Madagascar Vanilla Bean Paste,Tamar Valley Greek Yoghurt,Coles Bakery Stone Baked Wholemeal Pane Di Casa Loaf
Coles Lamb Meat Bones,Coles Sausage Mince,Primo Gourmet Beef & Pork Chorizo Sausage
Mayfair Blood Orange & Yuzu Gin 700mL,Powerade Isotonic Blackcurrent Sports Drink Flat Cap,Bulla Aussie Style Yoghurt Strawberry
Coles Corn Kernels,Coles Carrot Cupcakes 4 Pack,The Fishery Banana Prawn Meat
OB Finest Sourdough Crispbread Fig,Doritos Corn Chips Mexicana Share Pack,Coles Australian Made Maple Flavoured Streaky Bacon
Coles Vegetable Tart,Coles Tuna Sweet Chilli,Sanitarium Up&Go Liquid Breakfast Protein Energize Choc Fridge Pack 12X250mL
Cremorne Creamery Peanut Butter Choc,Peters Light & Creamy Classic Vanilla Ice Cream Tub,Hanabi Frozen Pork Potstickers
Coles Passionfruit Cheesecake Bar,Coles Bakery Mini Cheese And Bacon Rolls,Mr Chen's Ginger Prawn Dumplings
Fountain Mint Sauce For Roast Meat,The Kind Harvest Self Raising Flour,Cadbury Marvellous Creations Easter Bunny Gift Box
Obela Smooth Classic Hommus Dip,Coles Deli Danish Fetta Cheese,Gippsland Dairy Toffee & Honeycomb Twist Yoghurt
Gourmet Garden Coriander Cold Blended Paste,Coles Kitchen Asian Salad Kit,Cellucor C4 Sport Watermelon
Coles Beef Roast & Onion Garlic & Red Wine Rub,Coles Made Easy Slow Cooked Pork Ribs With Char Siu Sauce,Lilydale Free Range Chicken Stir Fry Large Pack
Tassal Salmon Portions Mustard And Dill,Coles Beef & Pork Meatballs Classic 28 Pack,Sunny Queen Free Range Extra Large Eggs 12 pack
Birds Eye Frozen Fish Fillets With Original  Crumb Oven Bake 6 pack,Gravox Cheese Sauce Mix,Helping Humans Lemon Lime 4x250mL
Minor Figures Light Oat Milk,Primo Silverside,Thomson's Deli Danish Salami
Cadbury More Fruit & Nut,Carman's Crunchy Clusters Cereal Berry,Sabrini Pure Ghee
Coles Natural Almonds,Coles Australian Salad Family Baby Leaf Blend,Cadbury Dairy Milk Caramello Chocolate Block
V2 Burger Plant Based 4 Pack,Coles Hot Smoked Salmon Natural,Goulburn River Hot Smoked Rainbow Trout
Coles Pumpkin Seeds,Coles Durian Loose,Coles Brushed Baby Potato
Tasti Smooshed Wholefood Balls Berry Cashew & Cacao,Carman's Super Berry Muesli,Lipton English Breakfast Black Tea Bags
K-Roo Cooked Kangaroo Fillet,Coles Kitchen Cheesy Tomato Pasta Salad,Coles Red Onion 1 Kg
Melrose Essential Reds,Ceres Organics Organic LSA With Probiotics,Three Threes Mint Jelly
Coles Beef Eye Fillet Roast,Coles Crumbed Fish Bites Salt & Pepper,Ocean Blue Mini Blinis
Bundaberg Diet Sarsaparilla Multipack Bottles 375mL,Deep Spring Natural Mineral Water Orange & Mango Multipack Mini Cans 6x250mL,Gelatissimo Gelato Cheesecake Swirl Tub
Coles Cholesterol Lowering Spread,Primo Stacker Mild Salami Cheese & Crackers,Calabria Pedro Ximenez 375mL
Coles Dairy Spicy Capsicum Dip,Mifroma Le Gruyere Aop,Lachlan Ridge Cabernet Merlot Cask 2Litre
Weight Watchers Frozen Chicken & Mushroom Fettuccine,McCain Lil Pizzas Ham & Cheese 4 Pack,Coles Frozen Fish Fillets Beer Battered
Coles Bakery Rock Cakes,Laucke Stoneground Rustic White,Helga's Sweet Potato Wrap
Mission Pita Pocket Original,Abe's Bagels Sesame Seed Bagels 4 Pack,Coles White Mud Cake
Ocean King Ocean King Anchovies Fillets,Coles Classic Beef Burgers,Coles Lamb Leg Steak With Middle Eastern Rub 2 Pack
Coles Bakery Hawaiian Pizza Roll,Thomson'S Deli English Style Ham Quad Pack,Thomson's Deli Devon
Coles Sliced Beetroot,Carman's Granola Grain Free Almond Macadamia Cashew & Pecan,The Spice Tailor Original Tikka Masala
Coles Lamb Mince,Coles Lamb Rack Roast,Coles Classic Pork Sausage
Coles No Added Sugar Dark Choc,F. Whitlock & Sons BBQ Mustard Thick Sauce,Maggi Original Liquid Seasoning
Coles Finest Australian Beef Rib Mountain Ash Smoked In Texan BBQ Sauce,Coles Deli Fresh Tasmanian Salmon Portions Skin Off,Coles Deli Fresh Saddletail Snapper Fillet
